FirstName,LastName,PostalCode,TrackingNo,Address
สาภัคพร,นภกานต์กิจ,11000,,
ทานันชัย,รชเมธาวิชัย,11000,,
ทาสินรักษ์,พลภัทรกิจ,11000,,
วีนันภา,ศรเดชธีรา,11000,,
นาลินนันท์,ชยกานต์ภาณุ,11000,,
นามินสิทธิ์,นภโชติมงคล,11000,,
ลานันชัย,ชยสิทธิ์วิชัย,11000,,
ศินันนันท์,ภรภัทรธีรา,11000,,
วีรินชัย,ภรภัทรวิชัย,11150,,
กิรัตเทพ,ภรสิทธิ์กิตติ,11150,,
นารัตภา,รชเดชอรุณ,11150,,
ศิรินเทพ,กฤเดชอนันต์,11150,,
ราธินพร,วรโชติอรุณ,11150,,
สาธินพร,ชยบูรณ์ธีรา,11150,,
ทาธีทร์,ชยสิทธิ์มงคล,11150,,
พารัตเทพ,นภกานต์อรุณ,11150,,
รามินรักษ์,นภภัทรกิจ,11150,,
รามินเทพ,ชยบูรณ์อนันต์,11150,,
ลาสินพร,สิรเมธาอรุณ,11150,,
ศินันสิทธิ์,ชยเมธามงคล,11150,,
พารัตพร,ศรโชติภาณุ,11150,,
นารินดา,สิรเมธากิตติ,11150,,
ทารัตสิทธิ์,พลเมธาศิริ,11150,,
สาธีกุล,วรเดชศิริ,11150,,
พารินพร,ธรภัทรอรุณ,11150,,
กิธินทร์,รชวัฒน์มงคล,11150,,
พามินนันท์,ธรวัฒน์ธีรา,11150,,
นาธีดา,ชยภัทรกิจ,11150,,
ลาวินกุล,วรโชติวิชัย,11150,,
สามินนันท์,ชยสิทธิ์พงศ์,11150,,
พาธีรักษ์,ธรเมธาศิริ,11150,,
ศิธินกุล,ภรบูรณ์ภาณุ,11150,,
พาสินรักษ์,กฤวัฒน์ธีรา,11150,,
สาธินพร,ภรสิทธิ์ศิริ,11150,,
กิสินกุล,ศรวัฒน์พงศ์,11150,,
สานันกุล,ศรเมธาศิริ,11150,,
พาภัคชัย,ธรภัทรมงคล,11150,,
รารัตภา,วรบูรณ์พงศ์,11150,,
กิมินกุล,ศรสิทธิ์ธีรา,12000,,
ราสินดา,นภเดชวิชัย,12000,,
ศิรัตทร์,ธรไกรกิตติ,12000,,
พาธินเทพ,ธรโชติกิตติ,12000,,
วีรินพร,ศรไกรวิชัย,12000,,
วีธินภา,ชยไกรศิริ,12000,,
ราธีรักษ์,กฤกานต์กิตติ,12000,,
นาวินพร,กฤกานต์อนันต์,12000,,
สาลินทร์,สิรเดชกิจ,12000,,
มิลินกุล,ธรภัทรศิริ,12000,,
สาสินกุล,นภไกรมงคล,12000,,
นามินดา,นภโชติภาณุ,12000,,
กิธีรักษ์,พลสิทธิ์วิชัย,12000,,
ทาธินเทพ,รชไกรธีรา,12000,,
ลาธินเทพ,นภบูรณ์ธีรา,12000,,
รารินชัย,ธรเดชศิริ,12000,,
ลาสินสิทธิ์,ศรไกรอรุณ,12000,,
กิรัตทร์,ธรไกรอรุณ,12000,,
ศิธินทร์,กฤไกรภาณุ,12000,,
ทาธีชัย,พลโชติภาณุ,12000,,
ศิวินพร,นภสิทธิ์อนันต์,12000,,
สารินเทพ,ภรบูรณ์ศิริ,12000,,
วีธินสิทธิ์,วรเมธากิตติ,12000,,
ศิรินพร,ภรสิทธิ์ภาณุ,12000,,
ทารัตเทพ,กฤวัฒน์กิจ,12000,,
ศิรัตทร์,พลวัฒน์อนันต์,12000,,
ศินันรักษ์,พลสิทธิ์อรุณ,12000,,
วีธินเทพ,กฤเดชพงศ์,12000,,
วีนันทร์,ธรภัทรอนันต์,12000,,
ลานันรักษ์,ธรกานต์อรุณ,12000,,
ศิรินภา,ภรบูรณ์อรุณ,12000,,
นาวินพร,นภไกรอนันต์,12000,,
วีรัตนันท์,พลไกรอรุณ,12000,,
มินันสิทธิ์,พลสิทธิ์ภาณุ,12000,,
สาภัคภา,ธรบูรณ์กิตติ,12110,,
วีภัคสิทธิ์,กฤวัฒน์มงคล,12110,,
ราธินเทพ,วรไกรมงคล,12110,,
ลารัตชัย,สิรภัทรศิริ,12110,,
พาภัคภา,ชยสิทธิ์กิตติ,12110,,
นาธีพร,วรกานต์วิชัย,12110,,
รามินชัย,พลกานต์อนันต์,12110,,
พาสินภา,รชโชติกิจ,12110,,
นาวินนันท์,วรโชติภาณุ,12110,,
ลาสินภา,กฤกานต์อนันต์,12110,,
กิรินทร์,นภบูรณ์วิชัย,12110,,
ศิธินพร,ศรไกรอนันต์,12110,,
ทารินดา,ชยภัทรพงศ์,12110,,
ลาธีดา,วรโชติกิจ,12110,,
ลาลินสิทธิ์,ชยเดชภาณุ,12110,,
พานันสิทธิ์,สิรเมธากิตติ,12110,,
นาธินเทพ,ศรภัทรศิริ,12110,,
ทารัตกุล,พลวัฒน์วิชัย,12110,,
วีมินชัย,ชยเมธาภาณุ,12110,,
สาภัคกุล,วรวัฒน์ศิริ,12110,,
รารินดา,นภเมธาพงศ์,12110,,
ทาลินพร,กฤสิทธิ์กิตติ,12110,,
มิรินเทพ,วรสิทธิ์มงคล,12110,,
มิภัคนันท์,กฤกานต์ภาณุ,12110,,
รานันดา,วรไกรพงศ์,12110,,
รารัตชัย,วรเรือนธีรา,12110,,
มิมินชัย,สิรบูรณ์อรุณ,12110,,
พาวินกุล,วรกานต์พงศ์,12110,,
มิสินกุล,นภโชติภาณุ,12110,,
สาภัคสิทธิ์,รชสิทธิ์ศิริ,12110,,
กิธีนันท์,รชเมธากิจ,12110,,
มิวินพร,ภรบูรณ์พงศ์,12110,,
ลาภัคสิทธิ์,กฤเดชอรุณ,12110,,
มิรัตสิทธิ์,รชกานต์กิตติ,12110,,
ราวินดา,พลกานต์อรุณ,12120,,
รารัตเทพ,ศรเดชอรุณ,12120,,
มิภัคนันท์,รชสิทธิ์ศิริ,12120,,
ศิลินสิทธิ์,รชเรือนธีรา,12120,,
พาภัคนันท์,รชสิทธิ์วิชัย,12120,,
นารัตทร์,รชวัฒน์ภาณุ,12120,,
ทาลินพร,ภรเมธาอนันต์,12120,,
มิรัตดา,ศรเดชภาณุ,12120,,
วีธีสิทธิ์,ชยบูรณ์มงคล,12120,,
สาลินชัย,นภเรือนพงศ์,12120,,
วีวินรักษ์,ภรเดชพงศ์,12120,,
สารัตทร์,วรเดชมงคล,12120,,
ทารินชัย,สิรบูรณ์มงคล,12120,,
กิธินเทพ,พลเรือนอนันต์,12120,,
ลาสินนันท์,พลไกรภาณุ,12120,,
รามินพร,กฤไกรอรุณ,12120,,
พาธีพร,นภเดชกิตติ,12120,,
นารัตสิทธิ์,กฤโชติพงศ์,12120,,
พาสินเทพ,นภวัฒน์อนันต์,12120,,
มิธินชัย,พลสิทธิ์ภาณุ,12120,,
ทามินรักษ์,ศรเรือนอรุณ,12120,,
ราวินสิทธิ์,รชเดชภาณุ,12120,,
พาลินดา,สิรโชติพงศ์,12120,,
มิวินนันท์,ภรโชติกิจ,12120,,
พามินกุล,ชยภัทรอรุณ,12120,,
ลาสินชัย,ธรเรือนศิริ,12120,,
กิรินภา,สิรวัฒน์พงศ์,12120,,
ราธีนันท์,สิรเดชอรุณ,12120,,
รารินพร,กฤสิทธิ์ศิริ,12120,,
สาธินชัย,ภรโชติอรุณ,12120,,
รารินรักษ์,ภรเดชธีรา,12120,,
ศิรินนันท์,ธรบูรณ์มงคล,12120,,
ศิรินชัย,ศรภัทรอรุณ,12120,,
พาภัคดา,วรบูรณ์ธีรา,12120,,
วีสินนันท์,รชกานต์ศิริ,12130,,
วีสินภา,วรเมธากิจ,12130,,
ลาลินกุล,ธรวัฒน์กิจ,12130,,
ลาสินภา,ชยไกรกิตติ,12130,,
ทาธีดา,รชเดชมงคล,12130,,
ราลินเทพ,ชยบูรณ์ศิริ,12130,,
สานันภา,ธรกานต์อนันต์,12130,,
พาภัคชัย,ชยบูรณ์วิชัย,12130,,
ทาลินพร,ชยภัทรวิชัย,12130,,
ทามินรักษ์,รชสิทธิ์ธีรา,12130,,
ลารัตพร,รชภัทรอรุณ,12130,,
นานันนันท์,สิรกานต์อรุณ,12130,,
พาสินรักษ์,ชยเรือนอรุณ,12130,,
มิลินภา,พลวัฒน์กิจ,12130,,
ลามินนันท์,ภรโชติมงคล,12130,,
พาภัคทร์,สิรภัทรอนันต์,12130,,
วีรัตรักษ์,พลไกรพงศ์,12130,,
วีสินรักษ์,ธรเรือนอนันต์,12130,,
มิธินภา,ภรไกรศิริ,12130,,
กิธีพร,ธรบูรณ์กิตติ,12130,,
พาวินพร,นภสิทธิ์มงคล,12130,,
พารินทร์,ชยภัทรกิจ,12130,,
พารินทร์,สิรโชติมงคล,12130,,
สานันพร,ธรวัฒน์ธีรา,12130,,
กิธินกุล,วรเดชอรุณ,12130,,
ทามินรักษ์,ศรโชติธีรา,12130,,
ราธีทร์,ธรวัฒน์อรุณ,12130,,
กิธินรักษ์,ภรภัทรมงคล,12130,,
กิภัคเทพ,ชยกานต์วิชัย,12130,,
วีสินดา,ภรโชติภาณุ,12130,,
สาภัคทร์,พลวัฒน์ศิริ,12130,,
กิรินรักษ์,สิรเดชภาณุ,12130,,
ลารัตกุล,ธรโชติอนันต์,12130,,
นารินเทพ,ศรเมธากิตติ,12130,,
กิธีนันท์,วรวัฒน์กิจ,12140,,
พาภัคสิทธิ์,ชยสิทธิ์มงคล,12140,,
นาสินนันท์,รชบูรณ์ภาณุ,12140,,
กิธีพร,วรภัทรกิตติ,12140,,
กิธินเทพ,กฤภัทรมงคล,12140,,
นาสินนันท์,ชยกานต์อนันต์,12140,,
ลารัตสิทธิ์,วรวัฒน์กิจ,12140,,
ศิวินทร์,กฤเดชศิริ,12140,,
นาวินนันท์,วรเดชภาณุ,12140,,
มิธีนันท์,นภบูรณ์ศิริ,12140,,
กิลินรักษ์,ชยเรือนวิชัย,12140,,
ศิวินเทพ,ชยเมธากิจ,12140,,
สาวินดา,วรสิทธิ์พงศ์,12140,,
พารินดา,ศรภัทรธีรา,12140,,
วีธินดา,พลบูรณ์อรุณ,12140,,
ลาสินภา,นภบูรณ์ศิริ,12140,,
พาภัคชัย,รชภัทรอรุณ,12140,,
วีรัตนันท์,วรสิทธิ์ภาณุ,12140,,
พาธินเทพ,พลไกรวิชัย,12140,,
กิธีสิทธิ์,ชยไกรมงคล,12140,,
พารินภา,กฤเมธาธีรา,12140,,
รารัตนันท์,รชสิทธิ์วิชัย,12140,,
นาลินรักษ์,ชยกานต์ธีรา,12140,,
กิลินกุล,สิรเดชอนันต์,12140,,
นาสินนันท์,พลโชติศิริ,12140,,
กินันทร์,กฤเมธาพงศ์,12140,,
ลารัตกุล,ภรสิทธิ์กิตติ,12140,,
ลาสินรักษ์,สิรวัฒน์กิจ,12140,,
พาสินทร์,วรเรือนภาณุ,12140,,
วีรัตชัย,นภบูรณ์ธีรา,12140,,
ทารัตสิทธิ์,พลเดชศิริ,12140,,
รารินกุล,นภวัฒน์กิจ,12140,,
สาลินเทพ,รชเรือนกิจ,12140,,
สามินดา,วรบูรณ์ธีรา,12140,,
รานันดา,สิรบูรณ์กิตติ,12150,,
สารินดา,พลเดชอรุณ,12150,,
พาธินทร์,ชยเรือนศิริ,12150,,
กิลินกุล,ธรบูรณ์กิตติ,12150,,
ลาธินดา,นภไกรมงคล,12150,,
วีสินนันท์,ชยเดชกิตติ,12150,,
ทารินภา,นภเมธาธีรา,12150,,
กินันทร์,นภเมธากิตติ,12150,,
สารินรักษ์,พลไกรวิชัย,12150,,
ราสินทร์,ภรโชติกิตติ,12150,,
มิธีชัย,ภรเรือนภาณุ,12150,,
สารัตทร์,พลเดชธีรา,12150,,
กิธีนันท์,สิรภัทรธีรา,12150,,
รามินกุล,ศรไกรภาณุ,12150,,
พารินกุล,วรสิทธิ์อนันต์,12150,,
รานันชัย,รชภัทรวิชัย,12150,,
นาสินพร,ภรกานต์ภาณุ,12150,,
มิลินชัย,รชบูรณ์มงคล,12150,,
มิมินกุล,ศรวัฒน์อรุณ,12150,,
พารัตพร,ธรเรือนศิริ,12150,,
ลาภัคเทพ,กฤไกรอรุณ,12150,,
มิสินกุล,ชยโชติกิตติ,12150,,
กิลินนันท์,รชสิทธิ์กิตติ,12150,,
นารินภา,ธรวัฒน์มงคล,12150,,
วีธินพร,ธรภัทรกิตติ,12150,,
ลารัตรักษ์,นภบูรณ์มงคล,12150,,
นาภัคเทพ,กฤวัฒน์ภาณุ,12150,,
พามินดา,วรเรือนศิริ,12150,,
สาภัคกุล,สิรสิทธิ์อนันต์,12150,,
พาธินรักษ์,สิรไกรอรุณ,12150,,
ลาวินดา,ธรกานต์ภาณุ,12150,,
มิวินเทพ,วรโชติวิชัย,12150,,
พาสินภา,พลภัทรภาณุ,12150,,
นาธินรักษ์,นภเรือนศิริ,12150,,
วีรินพร,ภรเดชอรุณ,12160,,
สารินดา,นภภัทรกิตติ,12160,,
พานันกุล,ชยวัฒน์กิตติ,12160,,
ลาภัคดา,กฤภัทรธีรา,12160,,
มิลินชัย,ชยโชติมงคล,12160,,
กิลินทร์,ภรวัฒน์พงศ์,12160,,
พารัตชัย,ธรกานต์กิจ,12160,,
วีรินชัย,กฤเมธามงคล,12160,,
รารินนันท์,รชเดชศิริ,12160,,
ทาธีทร์,ภรไกรพงศ์,12160,,
พาวินเทพ,สิรวัฒน์มงคล,12160,,
กิมินเทพ,สิรไกรธีรา,12160,,
กิธีเทพ,สิรเมธากิตติ,12160,,
มิธีทร์,ศรเรือนศิริ,12160,,
ลามินนันท์,ศรไกรอนันต์,12160,,
สารินเทพ,ชยกานต์มงคล,12160,,
กินันสิทธิ์,พลเดชกิตติ,12160,,
วีรัตชัย,วรโชติวิชัย,12160,,
นาธีพร,ชยวัฒน์มงคล,12160,,
วีธินดา,กฤเรือนวิชัย,12160,,
วีภัคชัย,ชยเรือนมงคล,12160,,
ทาลินทร์,วรบูรณ์ภาณุ,12160,,
มินันภา,วรไกรอนันต์,12160,,
วีภัคพร,สิรเรือนกิจ,12160,,
ลาสินเทพ,ชยไกรศิริ,12160,,
ลารัตชัย,ภรภัทรกิตติ,12160,,
ศิธินพร,วรภัทรภาณุ,12160,,
นาสินกุล,ศรเดชมงคล,12160,,
ศิรัตชัย,ภรโชติศิริ,12160,,
วีธีเทพ,ภรเรือนภาณุ,12160,,
มิสินทร์,วรวัฒน์พงศ์,12160,,
วีธีนันท์,พลกานต์อรุณ,12160,,
นาธินทร์,ภรสิทธิ์ภาณุ,12160,,
สานันทร์,พลเรือนมงคล,12160,,
นาธินพร,สิรเมธาภาณุ,12170,,
ราธีนันท์,สิรภัทรศิริ,12170,,
ราสินนันท์,นภเดชวิชัย,12170,,
พามินทร์,พลโชติพงศ์,12170,,
ศินันทร์,วรเรือนอนันต์,12170,,
ราวินรักษ์,พลไกรอรุณ,12170,,
นาวินรักษ์,สิรเมธาภาณุ,12170,,
นาลินทร์,สิรภัทรกิจ,12170,,
ศิวินทร์,พลวัฒน์ภาณุ,12170,,
ลาธีภา,สิรวัฒน์ภาณุ,12170,,
ศินันพร,พลสิทธิ์อรุณ,12170,,
ราวินภา,ธรสิทธิ์มงคล,12170,,
ลาวินทร์,สิรเมธาวิชัย,12170,,
ทาธีเทพ,ภรกานต์ธีรา,12170,,
สานันเทพ,สิรวัฒน์ภาณุ,12170,,
วีธีสิทธิ์,ชยสิทธิ์อนันต์,12170,,
มิรินภา,วรโชติภาณุ,12170,,
สาธินชัย,ภรไกรกิจ,12170,,
มิธินรักษ์,วรโชติอนันต์,12170,,
พาวินทร์,ศรสิทธิ์อนันต์,12170,,
ลาสินสิทธิ์,ศรไกรอนันต์,12170,,
พาธีชัย,วรวัฒน์ธีรา,12170,,
สานันดา,ภรกานต์กิจ,12170,,
ศิรินชัย,พลเดชธีรา,12170,,
สารัตเทพ,วรเมธาศิริ,12170,,
สาลินดา,ธรภัทรภาณุ,12170,,
นาธินกุล,ธรไกรกิตติ,12170,,
ทาวินกุล,รชวัฒน์อนันต์,12170,,
กิลินนันท์,ภรเรือนมงคล,12170,,
พาภัคภา,ภรโชติศิริ,12170,,
ราธินเทพ,สิรไกรกิตติ,12170,,
ทาธีทร์,พลบูรณ์กิจ,12170,,
สาธีชัย,ธรไกรกิจ,12170,,
ศิธินรักษ์,ศรเมธากิตติ,12170,,
มิลินภา,วรสิทธิ์ศิริ,13160,,
นานันนันท์,พลสิทธิ์มงคล,13160,,
ทาวินดา,ภรสิทธิ์กิจ,13160,,
ศิภัคกุล,สิรภัทรศิริ,13160,,
พาวินนันท์,ชยเมธาธีรา,13160,,
ศินันนันท์,วรบูรณ์วิชัย,13160,,
สาธีกุล,พลเดชธีรา,13160,,
นาธินดา,ศรไกรอรุณ,13160,,
มิภัคเทพ,พลเดชพงศ์,13160,,
ลาภัคดา,รชสิทธิ์อนันต์,13160,,
กิภัครักษ์,ชยภัทรอรุณ,13160,,
ทาธินทร์,ภรวัฒน์ธีรา,13160,,
ทาธินกุล,ภรวัฒน์กิตติ,13160,,
รารัตกุล,สิรไกรอนันต์,13160,,
นาธินดา,ภรสิทธิ์ภาณุ,13160,,
นาธีเทพ,นภกานต์กิจ,13160,,
กิลินภา,พลเมธาอรุณ,13160,,
มินันรักษ์,ภรเมธากิตติ,13160,,
รานันกุล,ธรภัทรกิตติ,13160,,
พาธินทร์,พลภัทรวิชัย,13160,,
วีนันนันท์,วรกานต์ศิริ,13160,,
รามินรักษ์,พลบูรณ์วิชัย,13160,,
กิธีเทพ,กฤเมธาพงศ์,13160,,
มิภัคพร,กฤภัทรอรุณ,13160,,
ลาสินทร์,ชยโชติกิจ,13160,,
นารัตชัย,วรกานต์กิตติ,13160,,
มิธีเทพ,พลเรือนอนันต์,13160,,
พาธีชัย,ศรเรือนกิตติ,13160,,
นามินภา,พลกานต์พงศ์,13160,,
สารินชัย,วรไกรภาณุ,13160,,
ราธินชัย,สิรบูรณ์ศิริ,13160,,
กินันกุล,กฤโชติอรุณ,13160,,
ทาธินทร์,ศรเรือนมงคล,13160,,
พานันชัย,พลภัทรภาณุ,13170,,
ราธินทร์,ธรกานต์ภาณุ,13170,,
ทามินนันท์,ศรสิทธิ์อรุณ,13170,,
นารัตภา,กฤภัทรอรุณ,13170,,
ศิมินพร,วรเดชศิริ,13170,,
วีวินทร์,ศรเมธากิตติ,13170,,
ราธินชัย,สิรไกรอนันต์,13170,,
ศิสินสิทธิ์,นภวัฒน์กิตติ,13170,,
มิลินทร์,สิรไกรภาณุ,13170,,
รารินรักษ์,กฤบูรณ์วิชัย,13170,,
ลาลินดา,ศรเมธาภาณุ,13170,,
วีสินชัย,รชกานต์ศิริ,13170,,
มิภัคทร์,ธรเดชมงคล,13170,,
มิสินรักษ์,ภรสิทธิ์ภาณุ,13170,,
ศิภัครักษ์,พลโชติกิตติ,13170,,
ราวินทร์,ภรสิทธิ์มงคล,13170,,
วีลินกุล,ภรเมธากิจ,13170,,
นารินรักษ์,นภเดชธีรา,13170,,
ราวินกุล,สิรกานต์ธีรา,13170,,
ลาธินภา,ชยไกรมงคล,13170,,
ศิวินพร,ภรไกรมงคล,13170,,
นามินนันท์,ภรวัฒน์ศิริ,13170,,
ศิธีดา,กฤกานต์ธีรา,13170,,
สารัตกุล,ภรโชติศิริ,13170,,
กิวินชัย,สิรบูรณ์กิจ,13170,,
ทาสินพร,กฤบูรณ์มงคล,13170,,
พาลินเทพ,พลไกรอรุณ,13170,,
ทารินพร,พลสิทธิ์ภาณุ,13170,,
ทาลินเทพ,นภเรือนอรุณ,13170,,
ทาลินดา,นภเรือนพงศ์,13170,,
สารัตนันท์,พลสิทธิ์ศิริ,13170,,
รารัตดา,กฤสิทธิ์อนันต์,13170,,
สาธินกุล,รชไกรศิริ,13170,,
ทานันภา,นภภัทรศิริ,13180,,
พารัตภา,นภเรือนมงคล,30220,,
สาภัคทร์,กฤเมธากิจ,30220,,
ลารัตชัย,รชเมธากิตติ,30220,,
มิภัคเทพ,รชเดชอรุณ,30220,,
ลาวินเทพ,นภภัทรวิชัย,30220,,
