FirstName,LastName,PostalCode,TrackingNo,Address
นาลินทร์,ชยภัทรอนันต์,26000,,
กิธินทร์,รชเมธาวิชัย,26000,,
รานันทร์,สิรเรือนมงคล,26000,,
นาธินนันท์,รชเรือนกิจ,26000,,
ศิวินรักษ์,สิรเมธาวิชัย,26000,,
วีรินกุล,ชยเรือนศิริ,26000,,
กิภัคกุล,ธรเมธากิจ,26000,,
มิธินสิทธิ์,ศรเดชพงศ์,26000,,
ลาธินชัย,ชยเดชวิชัย,26000,,
พาลินพร,ธรกานต์มงคล,26000,,
มิธีชัย,ชยภัทรอรุณ,26000,,
สาสินดา,วรกานต์ภาณุ,26000,,
นาสินดา,รชโชติวิชัย,26000,,
ลานันภา,นภเรือนธีรา,26000,,
ทานันกุล,ศรวัฒน์วิชัย,26000,,
ราสินชัย,วรบูรณ์มงคล,26000,,
วีธีเทพ,นภไกรวิชัย,26000,,
นาภัคพร,รชเมธามงคล,26000,,
กินันสิทธิ์,กฤโชติมงคล,26000,,
มิภัคนันท์,กฤสิทธิ์มงคล,26000,,
พาภัคพร,ธรโชติกิตติ,26000,,
รานันชัย,สิรเดชวิชัย,26000,,
วีลินพร,ธรภัทรภาณุ,26000,,
ทาวินรักษ์,วรบูรณ์ภาณุ,26000,,
มิธินกุล,วรวัฒน์อรุณ,26000,,
กิธีชัย,นภไกรอนันต์,26000,,
ศิสินนันท์,พลโชติกิจ,26000,,
ราธีดา,ชยสิทธิ์ภาณุ,26000,,
ลาธีสิทธิ์,พลภัทรธีรา,26000,,
กิมินนันท์,ธรกานต์อนันต์,26000,,
วีธินชัย,พลไกรอนันต์,26000,,
สามินนันท์,พลภัทรมงคล,26000,,
กิวินกุล,พลวัฒน์วิชัย,27000,,
ศิรินรักษ์,นภสิทธิ์ธีรา,27000,,
วีรัตรักษ์,พลบูรณ์กิจ,27000,,
สาธินดา,วรกานต์พงศ์,27000,,
นาธินชัย,ศรภัทรภาณุ,27000,,
มิธินกุล,รชไกรมงคล,27000,,
สาธินดา,นภเมธาอรุณ,27000,,
นาวินพร,พลภัทรธีรา,27000,,
พาธินพร,วรวัฒน์กิตติ,27000,,
สานันกุล,ธรโชติอรุณ,27000,,
พาภัคทร์,นภโชติพงศ์,27000,,
ศิรินสิทธิ์,รชกานต์อนันต์,27000,,
วีรัตพร,พลไกรมงคล,27000,,
พาธีชัย,พลไกรอนันต์,27000,,
ศิวินทร์,กฤภัทรกิจ,27000,,
นาลินชัย,ศรบูรณ์อรุณ,27000,,
สานันนันท์,ชยเรือนพงศ์,27000,,
ลานันเทพ,สิรบูรณ์วิชัย,27000,,
นาธีพร,กฤสิทธิ์ธีรา,27000,,
สาธินภา,พลภัทรวิชัย,27000,,
ทารินดา,นภเดชวิชัย,27000,,
วีธีภา,ศรโชติวิชัย,27000,,
ศิภัคพร,ธรบูรณ์อรุณ,27000,,
กิภัครักษ์,ธรไกรวิชัย,27000,,
นานันภา,ชยเดชพงศ์,27000,,
ทารินทร์,นภเมธาศิริ,27000,,
ศิรัตทร์,ชยกานต์วิชัย,27000,,
รารัตดา,กฤเรือนพงศ์,27000,,
รานันชัย,ศรวัฒน์ธีรา,27000,,
นาธีภา,ศรวัฒน์อนันต์,27000,,
วีนันรักษ์,ชยวัฒน์ภาณุ,27000,,
สามินดา,ภรโชติมงคล,27000,,
สานันกุล,ภรเดชศิริ,27000,,
พานันชัย,พลไกรวิชัย,27000,,
ลาลินเทพ,ภรเรือนอนันต์,27120,,
วีสินสิทธิ์,ธรเมธาวิชัย,27120,,
ทารัตนันท์,ศรเรือนธีรา,27120,,
ราธินชัย,ธรเรือนศิริ,27120,,
ราภัคเทพ,พลกานต์วิชัย,27120,,
ราวินดา,พลโชติอรุณ,27120,,
นารินรักษ์,รชไกรกิตติ,27120,,
กิรินนันท์,สิรบูรณ์กิตติ,27120,,
สามินชัย,รชวัฒน์มงคล,27120,,
สานันเทพ,ภรภัทรภาณุ,27120,,
พารัตภา,ศรวัฒน์พงศ์,27120,,
สารัตภา,สิรไกรภาณุ,27120,,
ศิธินเทพ,ธรวัฒน์พงศ์,27120,,
มิสินกุล,ชยเมธาธีรา,27120,,
นาลินรักษ์,ชยสิทธิ์วิชัย,27120,,
ศิสินเทพ,วรวัฒน์มงคล,27120,,
ลาสินกุล,วรเมธาอรุณ,27120,,
มิมินชัย,ภรไกรวิชัย,27120,,
มิธินชัย,นภไกรธีรา,27120,,
สารัตเทพ,ชยภัทรอนันต์,27120,,
นารินภา,สิรเรือนอนันต์,27120,,
กิลินเทพ,ภรวัฒน์ศิริ,27120,,
ลามินชัย,กฤเมธามงคล,27120,,
ทานันเทพ,รชสิทธิ์ธีรา,27120,,
วีรัตดา,วรโชติมงคล,27120,,
มิรินเทพ,ภรเดชภาณุ,27120,,
ทารัตเทพ,กฤเดชธีรา,27120,,
ราสินชัย,วรโชติกิจ,27120,,
ลารัตทร์,สิรภัทรกิจ,27120,,
ศิธีเทพ,ชยกานต์กิจ,27120,,
ศิภัคนันท์,กฤเมธามงคล,27120,,
วีลินสิทธิ์,ภรกานต์อรุณ,27120,,
ทาธีพร,ภรสิทธิ์กิตติ,27120,,
นาสินชัย,ชยบูรณ์กิจ,30000,,
ลาภัคดา,ชยไกรภาณุ,30000,,
พารัตดา,รชสิทธิ์กิตติ,30000,,
สาสินกุล,นภกานต์มงคล,30000,,
สาสินพร,สิรภัทรภาณุ,30000,,
มิลินสิทธิ์,พลภัทรกิจ,30000,,
ลารินเทพ,ชยเมธาอนันต์,30000,,
ทาธีพร,นภเดชมงคล,30000,,
วีภัคทร์,สิรเมธาธีรา,30000,,
พาธีชัย,พลกานต์วิชัย,30000,,
สาภัคเทพ,ธรเรือนธีรา,30000,,
ศิธินเทพ,ชยสิทธิ์อนันต์,30000,,
ทาลินชัย,กฤเดชภาณุ,30000,,
มิมินรักษ์,ภรเมธามงคล,30000,,
ลารัตนันท์,สิรไกรอรุณ,30000,,
ศิมินเทพ,ชยสิทธิ์ธีรา,30000,,
วีรัตชัย,รชภัทรอรุณ,30000,,
ศิสินทร์,กฤสิทธิ์พงศ์,30000,,
วีวินสิทธิ์,ชยเมธากิตติ,30000,,
ศิรินดา,ภรไกรพงศ์,30000,,
ศิมินเทพ,สิรเมธากิตติ,30000,,
นามินพร,สิรเดชพงศ์,30000,,
วีธินภา,ชยสิทธิ์ศิริ,30000,,
นามินสิทธิ์,ศรไกรภาณุ,30000,,
สาลินภา,ชยเดชธีรา,30000,,
กินันดา,สิรบูรณ์พงศ์,30000,,
ลาวินภา,ชยวัฒน์อนันต์,30000,,
ศิวินเทพ,สิรโชติกิตติ,30000,,
ลาลินรักษ์,ธรภัทรธีรา,30000,,
กิรัตภา,วรโชติวิชัย,30000,,
พามินรักษ์,ชยไกรธีรา,30000,,
วีนันพร,ชยสิทธิ์อนันต์,30000,,
ราธีสิทธิ์,กฤโชติกิจ,30000,,
มิธินสิทธิ์,นภวัฒน์กิจ,30000,,
ลานันภา,กฤเมธามงคล,30120,,
นาธีรักษ์,สิรบูรณ์อนันต์,30120,,
นามินดา,กฤบูรณ์อนันต์,30120,,
ราธีเทพ,นภบูรณ์ภาณุ,30120,,
ลานันทร์,พลไกรวิชัย,30120,,
พาสินสิทธิ์,สิรเรือนกิจ,30120,,
ราลินรักษ์,รชวัฒน์วิชัย,30120,,
ศิสินภา,กฤกานต์ธีรา,30120,,
กิมินดา,กฤภัทรภาณุ,30120,,
มิธีเทพ,ภรบูรณ์ธีรา,30120,,
สาธีรักษ์,ธรเรือนพงศ์,30120,,
พารัตทร์,วรเมธาวิชัย,30120,,
กินันรักษ์,รชบูรณ์ศิริ,30120,,
วีสินเทพ,ธรเมธาอนันต์,30120,,
วีมินพร,ภรกานต์อนันต์,30120,,
ลาภัคดา,สิรเดชธีรา,30120,,
ศิธีดา,นภวัฒน์กิจ,30120,,
ศิภัคนันท์,ธรเรือนวิชัย,30120,,
วีธีรักษ์,รชเมธากิตติ,30120,,
ราธีกุล,กฤโชติอนันต์,30120,,
ศิธีชัย,ศรเมธาวิชัย,30120,,
ทาวินรักษ์,สิรกานต์ธีรา,30120,,
วีรินนันท์,วรวัฒน์อนันต์,30120,,
กิภัคชัย,ชยไกรอรุณ,30120,,
ลาภัคดา,ชยโชติอนันต์,30120,,
กิลินกุล,สิรภัทรกิตติ,30120,,
รามินกุล,ศรบูรณ์อรุณ,30120,,
มิมินทร์,กฤโชติมงคล,30120,,
วีรัตเทพ,ศรกานต์พงศ์,30120,,
รารินชัย,ธรบูรณ์พงศ์,30120,,
ลารินเทพ,ชยโชติภาณุ,30120,,
พามินชัย,กฤเมธาศิริ,30120,,
นาธีภา,พลโชติศิริ,30120,,
ทาวินนันท์,สิรบูรณ์กิตติ,30130,,
มิสินภา,ภรกานต์มงคล,30130,,
ลาธีพร,ธรภัทรกิจ,30130,,
นาธินทร์,ภรเรือนพงศ์,30130,,
กิรัตพร,นภภัทรมงคล,30130,,
ทานันสิทธิ์,นภกานต์มงคล,30130,,
ศิธินกุล,ศรกานต์กิจ,30130,,
นาสินภา,ภรไกรมงคล,30130,,
ทานันเทพ,ศรบูรณ์กิตติ,30130,,
ศินันทร์,รชบูรณ์กิตติ,30130,,
นารัตนันท์,รชเรือนกิจ,30130,,
พารัตทร์,ศรไกรกิตติ,30130,,
นาลินภา,วรกานต์ธีรา,30130,,
พาธีชัย,ภรกานต์มงคล,30130,,
นาวินสิทธิ์,ศรเดชมงคล,30130,,
ศิสินกุล,สิรไกรมงคล,30130,,
ศิสินกุล,วรสิทธิ์พงศ์,30130,,
วีธินเทพ,ธรไกรอนันต์,30130,,
ทาสินภา,วรโชติมงคล,30130,,
มิธินสิทธิ์,สิรไกรกิตติ,30130,,
ทาธินเทพ,กฤบูรณ์มงคล,30130,,
กิวินภา,สิรภัทรศิริ,30130,,
วีรัตดา,วรไกรอรุณ,30130,,
รานันกุล,ศรเมธาศิริ,30130,,
นารินสิทธิ์,รชโชติกิตติ,30130,,
สาวินดา,ภรสิทธิ์พงศ์,30130,,
ลาสินภา,นภเรือนกิตติ,30130,,
ราภัคชัย,ศรสิทธิ์กิจ,30130,,
นาธินชัย,วรสิทธิ์มงคล,30130,,
ทาสินรักษ์,กฤไกรธีรา,30130,,
นาธินชัย,วรภัทรกิตติ,30130,,
ทาธีทร์,กฤกานต์ธีรา,30130,,
กิธีภา,นภสิทธิ์กิจ,30130,,
ราธีรักษ์,ภรวัฒน์กิตติ,30140,,
ราภัคชัย,กฤโชติกิตติ,30140,,
ลาลินภา,สิรสิทธิ์กิตติ,30140,,
มิมินภา,สิรโชติธีรา,30140,,
สาธินรักษ์,นภวัฒน์ธีรา,30140,,
วีรัตกุล,ชยเดชอนันต์,30140,,
ลาธินกุล,พลบูรณ์มงคล,30140,,
สาภัคทร์,ชยเมธาพงศ์,30140,,
นานันภา,ธรเมธาวิชัย,30140,,
มิรัตชัย,ธรภัทรมงคล,30140,,
รารินรักษ์,ศรวัฒน์ศิริ,30140,,
กินันนันท์,นภสิทธิ์อนันต์,30140,,
ศิสินทร์,พลเรือนวิชัย,30140,,
กิมินชัย,นภไกรกิจ,30140,,
วีรัตภา,กฤสิทธิ์อนันต์,30140,,
กิมินนันท์,ภรภัทรอนันต์,30140,,
พาลินดา,รชเรือนกิจ,30140,,
ศิลินภา,รชเดชกิตติ,30140,,
ราธินนันท์,พลโชติกิจ,30140,,
กิภัคนันท์,วรโชติศิริ,30140,,
รานันกุล,ศรภัทรพงศ์,30140,,
ราภัคกุล,ธรเดชธีรา,30140,,
ลาลินชัย,ศรเรือนศิริ,30140,,
ลาธีภา,ภรวัฒน์วิชัย,30140,,
สานันพร,ศรกานต์ภาณุ,30140,,
ราภัคเทพ,รชเดชอนันต์,30140,,
กิธีกุล,ชยไกรอรุณ,30140,,
มิรินกุล,ศรโชติศิริ,30140,,
มิวินนันท์,ศรเมธาธีรา,30140,,
กิภัคนันท์,นภบูรณ์ศิริ,30140,,
ทาวินรักษ์,นภบูรณ์อรุณ,30140,,
พารินชัย,ธรวัฒน์ภาณุ,30140,,
ทาวินกุล,ชยบูรณ์มงคล,30140,,
พาธีรักษ์,ศรเรือนศิริ,30190,,
สาธินพร,กฤวัฒน์วิชัย,30190,,
นาภัคชัย,สิรบูรณ์พงศ์,30190,,
สาวินเทพ,ธรสิทธิ์ธีรา,30190,,
รารินชัย,สิรกานต์ศิริ,30190,,
พารินดา,สิรบูรณ์มงคล,30190,,
มิลินกุล,ศรเรือนกิตติ,30190,,
วีธินทร์,วรสิทธิ์วิชัย,30190,,
วีธีพร,ภรสิทธิ์ธีรา,30190,,
สาสินเทพ,พลสิทธิ์กิตติ,30190,,
ศิธินพร,สิรบูรณ์ภาณุ,30190,,
นาวินรักษ์,ภรกานต์ธีรา,30190,,
นามินนันท์,สิรไกรพงศ์,30190,,
ทาสินชัย,ภรไกรกิจ,30190,,
ทาวินสิทธิ์,วรเรือนวิชัย,30190,,
ราสินพร,นภไกรกิจ,30190,,
ทาลินกุล,สิรเรือนภาณุ,30190,,
พาวินรักษ์,ศรไกรมงคล,30190,,
ทาลินรักษ์,ชยวัฒน์มงคล,30190,,
ลานันนันท์,ศรเดชอรุณ,30190,,
ลาสินกุล,วรเมธากิจ,30190,,
วีธีพร,ชยเรือนธีรา,30190,,
รารินนันท์,พลเดชกิจ,30190,,
ทานันชัย,สิรเดชพงศ์,30190,,
ศิลินดา,รชกานต์วิชัย,30190,,
ทามินนันท์,รชวัฒน์ภาณุ,30190,,
ทาภัคดา,พลภัทรธีรา,30190,,
นาวินนันท์,สิรเดชอรุณ,30190,,
พาธินพร,นภเดชศิริ,30190,,
ราภัคดา,รชสิทธิ์กิจ,30190,,
วีธีพร,วรกานต์ศิริ,30190,,
ทามินชัย,ภรกานต์ศิริ,30190,,
พารินชัย,ภรสิทธิ์ธีรา,30190,,
ลาภัคภา,ชยเดชอรุณ,30220,,
ราธีชัย,วรภัทรกิจ,30220,,
วีลินเทพ,รชโชติกิตติ,30220,,
ลานันเทพ,วรกานต์ธีรา,30220,,
พารัตภา,นภเรือนมงคล,30220,,
สาภัคทร์,กฤเมธากิจ,30220,,
ลารัตชัย,รชเมธากิตติ,30220,,
มิภัคเทพ,รชเดชอรุณ,30220,,
ลาวินเทพ,นภภัทรวิชัย,30220,,
มิรัตภา,สิรไกรวิชัย,30220,,
กิธีชัย,สิรเดชศิริ,31000,,
รารินพร,รชเมธากิตติ,31000,,
ลาลินภา,ชยเรือนภาณุ,31000,,
พาสินสิทธิ์,ภรบูรณ์กิจ,31000,,
วีธีภา,กฤกานต์อรุณ,31000,,
ทาสินรักษ์,ศรภัทรกิจ,31000,,
สาธินชัย,รชเมธาธีรา,31000,,
พาธินทร์,วรไกรมงคล,31000,,
ทาสินทร์,ธรเมธาอนันต์,31000,,
มิมินดา,ภรเรือนธีรา,31000,,
สานันกุล,ธรโชติวิชัย,31000,,
กิสินเทพ,วรวัฒน์อรุณ,31000,,
ศิลินกุล,ชยเมธาภาณุ,31000,,
วีรินดา,ธรสิทธิ์ภาณุ,31000,,
รารัตดา,ภรเรือนภาณุ,31000,,
ทาธีรักษ์,รชบูรณ์กิตติ,31000,,
วีนันรักษ์,รชสิทธิ์กิจ,31000,,
กิธินชัย,วรเดชกิตติ,31000,,
สาภัคเทพ,นภเรือนวิชัย,31000,,
ราวินภา,ศรเดชธีรา,31000,,
พาวินภา,ศรสิทธิ์ธีรา,31000,,
วีธีภา,กฤเรือนวิชัย,31000,,
นารินรักษ์,สิรกานต์อรุณ,31000,,
ศิรัตชัย,สิรวัฒน์กิตติ,31000,,
นารัตทร์,นภบูรณ์อนันต์,31000,,
พาภัคสิทธิ์,ธรวัฒน์มงคล,31000,,
มินันเทพ,รชสิทธิ์ธีรา,31000,,
ลาลินเทพ,สิรเมธาอรุณ,31000,,
พารินพร,ศรบูรณ์กิตติ,31000,,
สานันชัย,ศรสิทธิ์กิตติ,31000,,
กิวินชัย,ศรเรือนภาณุ,31000,,
ทาภัครักษ์,ภรวัฒน์ภาณุ,31000,,
สานันเทพ,ชยบูรณ์พงศ์,31000,,
ศิมินเทพ,นภบูรณ์ธีรา,31000,,
ลารัตพร,รชกานต์ศิริ,31110,,
นารินทร์,กฤโชติศิริ,31110,,
สาวินชัย,นภไกรอรุณ,31110,,
นาภัคสิทธิ์,ศรเรือนกิจ,31110,,
สารัตภา,กฤวัฒน์วิชัย,31110,,
กินันนันท์,รชสิทธิ์พงศ์,31110,,
ลาธีรักษ์,รชเดชมงคล,31110,,
มิสินนันท์,กฤโชติธีรา,31110,,
พาวินสิทธิ์,กฤวัฒน์อนันต์,31110,,
วีรัตทร์,นภเมธาพงศ์,31110,,
นาวินสิทธิ์,วรกานต์อนันต์,31110,,
สารัตเทพ,กฤโชติวิชัย,31110,,
พาลินกุล,ธรวัฒน์ธีรา,31110,,
ลาภัครักษ์,สิรเดชวิชัย,31110,,
พารัตดา,สิรไกรกิจ,31110,,
วีภัคพร,ภรบูรณ์ศิริ,31110,,
ราสินสิทธิ์,นภวัฒน์อนันต์,31110,,
พารินชัย,วรกานต์วิชัย,31110,,
นาธินเทพ,สิรบูรณ์ศิริ,31110,,
ลามินชัย,สิรเดชพงศ์,31110,,
ราลินรักษ์,นภไกรกิจ,31110,,
ทาลินชัย,พลโชติมงคล,31110,,
ลาธินภา,กฤสิทธิ์วิชัย,31110,,
ทาธีภา,ชยเมธากิตติ,31110,,
ราสินทร์,กฤภัทรอนันต์,31110,,
กิธินกุล,วรเมธาธีรา,31110,,
ทารัตรักษ์,ชยกานต์พงศ์,31110,,
ทาธีพร,รชเมธากิตติ,31110,,
นานันพร,สิรวัฒน์ธีรา,31110,,
มิภัคภา,พลภัทรมงคล,31110,,
มิลินเทพ,ชยเมธากิตติ,31110,,
พารัตสิทธิ์,วรวัฒน์วิชัย,31110,,
ศินันทร์,ธรโชติกิจ,31110,,
ศิภัคเทพ,ชยไกรมงคล,31110,,
ราธินชัย,ชยสิทธิ์อนันต์,32000,,
สามินสิทธิ์,วรสิทธิ์กิตติ,32000,,
วีสินชัย,ธรบูรณ์พงศ์,32000,,
ศิรินรักษ์,ธรเรือนกิตติ,32000,,
นารินสิทธิ์,พลโชติอรุณ,32000,,
นารัตพร,รชเดชภาณุ,32000,,
ศินันสิทธิ์,นภเมธากิตติ,32000,,
ทาสินทร์,รชกานต์ธีรา,32000,,
ลาธินทร์,ภรไกรกิตติ,32000,,
พารินภา,รชสิทธิ์วิชัย,32000,,
พามินภา,ธรบูรณ์ศิริ,32000,,
สาลินรักษ์,สิรภัทรพงศ์,32000,,
ทานันเทพ,ชยบูรณ์พงศ์,32000,,
พามินกุล,กฤภัทรภาณุ,32000,,
พาธีภา,ชยไกรกิตติ,32000,,
ลาสินกุล,วรโชติกิตติ,32000,,
ราสินเทพ,กฤภัทรภาณุ,32000,,
พาธินดา,พลบูรณ์ศิริ,32000,,
สารินรักษ์,นภเรือนภาณุ,32000,,
วีธินนันท์,ศรเดชภาณุ,32000,,
นารินดา,กฤโชติพงศ์,32000,,
นาธินดา,รชโชติศิริ,32000,,
วีสินชัย,สิรเรือนพงศ์,32000,,
มิธีกุล,นภไกรธีรา,32000,,
มิรัตรักษ์,กฤโชติพงศ์,32000,,
พาธีสิทธิ์,ธรเมธาภาณุ,32000,,
วีรินพร,ธรบูรณ์อรุณ,32000,,
วีธีกุล,สิรเรือนศิริ,32000,,
ทานันดา,วรภัทรภาณุ,32000,,
มิธีพร,ชยบูรณ์ศิริ,32000,,
ศิวินดา,ภรเรือนมงคล,32000,,
กิสินภา,พลกานต์กิตติ,32000,,
พานันภา,ศรเดชภาณุ,32000,,
นาธินกุล,วรเดชกิจ,32000,,
มิลินทร์,รชบูรณ์อรุณ,32110,,
สาสินดา,วรสิทธิ์วิชัย,32110,,
มิสินกุล,กฤเมธาอนันต์,32110,,
กิมินรักษ์,พลภัทรภาณุ,32110,,
