FirstName,LastName,PostalCode,TrackingNo,Address
พารัตดา,ชยไกรกิจ,18110,,
ทาธีชัย,สิรสิทธิ์ภาณุ,18110,,
พาธินชัย,พลเมธาธีรา,18110,,
พาภัคสิทธิ์,วรเรือนวิชัย,18110,,
ราลินรักษ์,พลวัฒน์มงคล,18110,,
รามินเทพ,ศรวัฒน์กิตติ,18110,,
ทามินดา,วรวัฒน์ภาณุ,18110,,
มิรัตทร์,ภรไกรศิริ,18110,,
วีลินดา,ธรโชติกิจ,18110,,
ศิมินเทพ,วรสิทธิ์ภาณุ,18110,,
มิลินรักษ์,พลโชติกิตติ,18110,,
มิมินทร์,นภกานต์พงศ์,20110,,
สาภัคภา,ภรภัทรศิริ,20110,,
มิสินเทพ,กฤวัฒน์กิจ,20110,,
วีธินรักษ์,สิรสิทธิ์อนันต์,20110,,
ราภัคเทพ,พลโชติพงศ์,20110,,
ราธีภา,กฤสิทธิ์วิชัย,20110,,
ราธินชัย,สิรเดชภาณุ,20110,,
นาสินภา,กฤเดชกิตติ,20110,,
นาธีกุล,สิรกานต์ธีรา,20110,,
ศิภัคพร,รชโชติอนันต์,20110,,
สาภัครักษ์,นภเรือนศิริ,20110,,
กิรินรักษ์,สิรไกรธีรา,20110,,
สาวินดา,กฤภัทรภาณุ,20110,,
กิรินนันท์,ธรเรือนวิชัย,20110,,
พารัตชัย,ศรเมธาศิริ,20110,,
ลาธีทร์,ศรกานต์กิจ,20110,,
วีนันรักษ์,ชยเดชมงคล,20110,,
ศิลินชัย,กฤไกรมงคล,20110,,
ราธินเทพ,นภเรือนอรุณ,20110,,
นาลินรักษ์,ชยเดชมงคล,20110,,
พาสินนันท์,นภเมธามงคล,20110,,
สารัตสิทธิ์,กฤเดชอนันต์,20110,,
กินันรักษ์,กฤไกรกิจ,20110,,
ทาสินรักษ์,ธรเดชมงคล,20110,,
ศิสินรักษ์,ศรไกรอนันต์,20110,,
ศิวินชัย,พลเดชธีรา,20110,,
สาสินรักษ์,นภสิทธิ์มงคล,20110,,
มิวินทร์,นภโชติกิจ,20110,,
มิธินพร,ชยโชติธีรา,20110,,
วีมินเทพ,ธรบูรณ์ธีรา,20110,,
วีภัคชัย,ภรเมธากิตติ,20110,,
นาลินสิทธิ์,รชสิทธิ์อนันต์,20110,,
พาวินสิทธิ์,ภรบูรณ์พงศ์,20110,,
กิธินดา,รชเรือนอรุณ,20150,,
พารินสิทธิ์,กฤเรือนอนันต์,20150,,
นารินดา,ศรเมธาภาณุ,20150,,
นานันชัย,พลโชติอนันต์,20150,,
กิมินนันท์,ภรเรือนอรุณ,20150,,
พาวินเทพ,รชวัฒน์ภาณุ,20150,,
พานันเทพ,วรเรือนพงศ์,20150,,
ลาวินทร์,นภวัฒน์พงศ์,20150,,
พาภัครักษ์,กฤวัฒน์กิจ,20150,,
สารัตพร,ภรภัทรกิจ,20150,,
กินันดา,วรกานต์ศิริ,20150,,
พารัตนันท์,นภโชติพงศ์,20150,,
วีธินพร,กฤโชติพงศ์,20150,,
ทาสินเทพ,นภกานต์มงคล,20150,,
มิธินเทพ,กฤบูรณ์กิตติ,20150,,
วีลินรักษ์,กฤสิทธิ์ภาณุ,20150,,
กิลินกุล,พลไกรกิจ,20150,,
ลาลินทร์,ชยเรือนอนันต์,20150,,
สามินพร,รชสิทธิ์อนันต์,20150,,
นารัตดา,สิรเมธาธีรา,20150,,
ทาธีสิทธิ์,รชบูรณ์กิจ,20150,,
มิรัตทร์,นภโชติกิจ,20150,,
ทาธีดา,พลเมธาภาณุ,20150,,
กิรินนันท์,กฤเมธาภาณุ,20150,,
นาสินดา,รชโชติอรุณ,20150,,
ศิรินภา,รชวัฒน์ภาณุ,20150,,
ทารินพร,ชยวัฒน์ศิริ,20150,,
ศิรินกุล,วรสิทธิ์ศิริ,20150,,
สาภัคทร์,ภรโชติพงศ์,20150,,
กิธินดา,รชเดชอนันต์,20150,,
พาวินรักษ์,ธรเรือนวิชัย,20150,,
กิสินดา,สิรวัฒน์มงคล,20150,,
มิรัตดา,วรสิทธิ์อนันต์,20150,,
ทาวินกุล,นภเดชอรุณ,20160,,
ทาลินทร์,พลเดชอนันต์,20160,,
ศิวินภา,ศรเมธาอรุณ,20160,,
วีมินรักษ์,ธรโชติอนันต์,20160,,
มิธีกุล,รชเมธาภาณุ,20160,,
พารัตภา,ธรสิทธิ์อนันต์,20160,,
นาลินนันท์,วรเดชพงศ์,20160,,
ลารัตเทพ,ธรเรือนกิตติ,20160,,
มิวินชัย,ศรเมธาวิชัย,20160,,
กิลินภา,ภรไกรกิตติ,20160,,
รารินดา,ชยโชติวิชัย,20160,,
วีภัคพร,ธรโชติกิตติ,20160,,
นาภัคทร์,พลเดชกิจ,20160,,
กิรัตดา,วรเรือนกิตติ,20160,,
พาลินภา,กฤเดชศิริ,20160,,
สาธินภา,ศรภัทรมงคล,20160,,
ทาภัคกุล,พลบูรณ์ธีรา,20160,,
พาสินพร,รชกานต์อรุณ,20160,,
นานันสิทธิ์,วรสิทธิ์ธีรา,20160,,
กิธินเทพ,สิรบูรณ์ธีรา,20160,,
ทาภัคชัย,พลภัทรพงศ์,20160,,
ศิธินรักษ์,วรสิทธิ์อนันต์,20160,,
ราวินชัย,กฤเรือนกิตติ,20160,,
พาภัคเทพ,ธรสิทธิ์อรุณ,20160,,
ราภัคชัย,ธรไกรมงคล,20160,,
วีรินทร์,ภรเมธาศิริ,20160,,
กิมินพร,ภรโชติอรุณ,20160,,
มิวินดา,พลกานต์อรุณ,20160,,
มิธีพร,ชยวัฒน์มงคล,20160,,
ลาธินพร,สิรไกรพงศ์,20160,,
ราธีทร์,ศรภัทรกิตติ,20160,,
ราภัคเทพ,ชยวัฒน์พงศ์,20160,,
ศิภัคนันท์,นภกานต์มงคล,20160,,
ลาลินทร์,ชยภัทรอรุณ,20170,,
ศิรัตพร,กฤกานต์กิจ,20170,,
ราลินรักษ์,ธรภัทรพงศ์,20170,,
ศิลินทร์,รชเมธาอรุณ,20170,,
กิธีทร์,ภรเดชศิริ,20170,,
ราสินทร์,พลเดชกิจ,20170,,
ทาวินสิทธิ์,วรกานต์กิจ,20170,,
ทาวินรักษ์,นภโชติวิชัย,20170,,
สารินเทพ,ศรบูรณ์อรุณ,20170,,
มิรัตเทพ,สิรเรือนอรุณ,20170,,
ทาวินพร,ธรโชติมงคล,20170,,
กิสินภา,พลโชติมงคล,20170,,
ลามินกุล,ภรเรือนอนันต์,20170,,
มิรัตเทพ,สิรสิทธิ์พงศ์,20170,,
กิธินทร์,วรเรือนศิริ,20170,,
มิสินพร,รชโชติอนันต์,20170,,
ลาภัคดา,กฤวัฒน์กิตติ,20170,,
พาวินดา,กฤไกรอนันต์,20170,,
ทาธีกุล,สิรโชติภาณุ,20170,,
รานันชัย,รชบูรณ์ภาณุ,20170,,
มิวินพร,วรโชติกิตติ,20170,,
กิรัตสิทธิ์,สิรบูรณ์อนันต์,20170,,
ทารัตสิทธิ์,สิรเดชมงคล,20170,,
ราธีสิทธิ์,ธรวัฒน์กิตติ,20170,,
สาวินชัย,สิรบูรณ์มงคล,20170,,
ทานันสิทธิ์,ศรโชติพงศ์,20170,,
พามินภา,สิรกานต์อรุณ,20170,,
พานันรักษ์,วรโชติกิตติ,20170,,
ศิธินภา,ศรภัทรธีรา,20170,,
วีภัครักษ์,ธรภัทรกิตติ,20170,,
ลาธินพร,ภรภัทรอรุณ,20170,,
กิมินรักษ์,ชยกานต์อรุณ,20170,,
วีธินกุล,รชเมธาพงศ์,20170,,
วีรินสิทธิ์,นภโชติมงคล,20230,,
มิรัตชัย,ภรเมธาธีรา,20230,,
สาธีนันท์,ธรเดชศิริ,20230,,
นาภัคภา,ชยเดชกิตติ,20230,,
มิสินรักษ์,สิรโชติพงศ์,20230,,
นาภัคภา,พลบูรณ์มงคล,20230,,
ลาภัคนันท์,ชยไกรธีรา,20230,,
ราธีพร,ศรกานต์พงศ์,20230,,
ทาสินพร,นภโชติวิชัย,20230,,
พารัตพร,พลเรือนธีรา,20230,,
วีธีเทพ,วรโชติวิชัย,20230,,
มิภัคทร์,ชยเมธามงคล,20230,,
นาลินเทพ,วรไกรศิริ,20230,,
กินันกุล,วรเดชอรุณ,20230,,
มิธีชัย,ธรบูรณ์วิชัย,20230,,
มิธีพร,ชยบูรณ์มงคล,20230,,
ราภัคดา,ภรเมธาวิชัย,20230,,
พารัตภา,ธรกานต์กิจ,20230,,
ราภัคทร์,ธรสิทธิ์ภาณุ,20230,,
สาภัคดา,วรเดชศิริ,20230,,
มิรัตเทพ,ชยเมธากิจ,20230,,
กิรัตเทพ,นภเมธาอนันต์,20230,,
กิมินเทพ,วรไกรศิริ,20230,,
มิธินพร,รชไกรกิจ,20230,,
มิภัคดา,วรวัฒน์อรุณ,20230,,
กิสินสิทธิ์,กฤเมธาอนันต์,20230,,
ทาภัคชัย,ธรโชติมงคล,20230,,
นารินนันท์,ธรกานต์กิตติ,20230,,
พาธินนันท์,พลกานต์กิตติ,20230,,
สาวินดา,สิรสิทธิ์ธีรา,20230,,
ศิธินรักษ์,รชวัฒน์วิชัย,20230,,
พานันดา,พลสิทธิ์กิจ,20230,,
ศิลินกุล,ชยเมธาศิริ,20230,,
กิวินพร,พลภัทรศิริ,22110,,
ราภัคชัย,กฤเรือนมงคล,22110,,
วีลินชัย,สิรบูรณ์มงคล,22110,,
ราสินเทพ,กฤไกรภาณุ,22110,,
สามินรักษ์,รชวัฒน์อนันต์,22110,,
กิภัคดา,วรเมธาภาณุ,22110,,
ศิมินทร์,วรวัฒน์กิตติ,22110,,
นาธีรักษ์,ชยภัทรกิตติ,22110,,
สาสินพร,ศรโชติกิจ,22110,,
รารินภา,สิรเมธาอนันต์,22110,,
วีธินชัย,พลกานต์มงคล,22110,,
กิรัตภา,ศรภัทรภาณุ,22110,,
กิธีเทพ,นภวัฒน์อรุณ,22110,,
พารินชัย,พลไกรอรุณ,22110,,
ลานันกุล,นภภัทรภาณุ,22110,,
วีวินชัย,กฤเมธาศิริ,22110,,
รารัตเทพ,พลไกรกิตติ,22110,,
มิรัตดา,ภรกานต์ภาณุ,22110,,
มินันทร์,ธรเรือนวิชัย,22110,,
ทารัตภา,กฤเมธาภาณุ,22110,,
ทารัตทร์,กฤเมธาศิริ,22110,,
ลาลินนันท์,ภรวัฒน์กิจ,22110,,
ทารินเทพ,ชยโชติธีรา,22110,,
วีสินรักษ์,ภรสิทธิ์มงคล,22110,,
กิสินชัย,กฤภัทรพงศ์,22110,,
ลารัตชัย,ภรกานต์อนันต์,22110,,
ลาธีเทพ,รชวัฒน์กิจ,22110,,
รารัตทร์,ชยเมธาธีรา,22110,,
นามินทร์,กฤกานต์มงคล,22110,,
ศินันพร,พลวัฒน์กิตติ,22110,,
กิสินนันท์,วรเรือนกิจ,22110,,
นาธีกุล,กฤไกรอรุณ,22110,,
มิลินกุล,นภสิทธิ์ศิริ,22110,,
ลาธีพร,ชยบูรณ์ศิริ,22110,,
นาสินสิทธิ์,นภวัฒน์กิตติ,23000,,
พาธีกุล,พลโชติวิชัย,23000,,
พาสินดา,สิรวัฒน์ธีรา,23000,,
กิสินเทพ,กฤเดชอรุณ,23000,,
พาลินนันท์,ธรเมธาพงศ์,23000,,
ศินันนันท์,พลสิทธิ์มงคล,23000,,
ลาธินทร์,วรบูรณ์กิจ,23000,,
ราลินรักษ์,สิรสิทธิ์อรุณ,23000,,
สารินทร์,กฤกานต์ภาณุ,23000,,
ศิภัคชัย,วรวัฒน์อนันต์,23000,,
ศิวินนันท์,ศรวัฒน์ธีรา,23000,,
ศิสินทร์,กฤเรือนภาณุ,23000,,
นาวินกุล,ชยเรือนมงคล,23000,,
ลาธินทร์,ศรโชติอนันต์,23000,,
ลาภัคทร์,ธรเมธาศิริ,23000,,
สารัตกุล,ภรบูรณ์มงคล,23000,,
กิรินนันท์,รชเมธาอนันต์,23000,,
นารัตชัย,ธรเรือนวิชัย,23000,,
พารินภา,สิรเรือนธีรา,23000,,
วีมินเทพ,วรวัฒน์อรุณ,23000,,
ศิสินนันท์,พลเรือนศิริ,23000,,
นารินทร์,ภรสิทธิ์อนันต์,23000,,
ทารัตพร,ภรบูรณ์มงคล,23000,,
กิรินเทพ,วรสิทธิ์วิชัย,23000,,
สารัตทร์,พลเดชพงศ์,23000,,
นามินภา,รชเรือนกิจ,23000,,
นามินเทพ,พลภัทรวิชัย,23000,,
ทารินเทพ,กฤโชติกิจ,23000,,
ลาธินนันท์,กฤสิทธิ์อรุณ,23000,,
ทารินทร์,ชยเมธาอรุณ,23000,,
ลามินพร,ภรกานต์วิชัย,23000,,
มิรินชัย,ภรบูรณ์มงคล,23000,,
ราลินเทพ,รชกานต์กิจ,23000,,
พาธินพร,ธรบูรณ์กิจ,23000,,
พารินกุล,สิรภัทรธีรา,24000,,
ลาสินกุล,วรภัทรวิชัย,24000,,
สาวินพร,กฤภัทรอรุณ,24000,,
วีภัคพร,กฤเมธาวิชัย,24000,,
ศิธีเทพ,ธรบูรณ์มงคล,24000,,
มิรัตชัย,วรภัทรกิจ,24000,,
สาธีภา,ภรกานต์กิตติ,24000,,
ลารัตนันท์,สิรวัฒน์ธีรา,24000,,
ศิลินพร,รชบูรณ์ภาณุ,24000,,
พาธีชัย,กฤโชติกิจ,24000,,
รามินกุล,พลกานต์มงคล,24000,,
กิภัคเทพ,ภรเดชพงศ์,24000,,
มินันพร,นภเรือนอนันต์,24000,,
นาสินสิทธิ์,ชยเมธาวิชัย,24000,,
พานันรักษ์,รชสิทธิ์กิจ,24000,,
วีสินกุล,ภรเรือนวิชัย,24000,,
มิสินทร์,สิรเรือนศิริ,24000,,
กิวินทร์,ธรเรือนอรุณ,24000,,
ทานันเทพ,วรเรือนศิริ,24000,,
วีมินเทพ,สิรเรือนกิจ,24000,,
พาธีชัย,รชกานต์ธีรา,24000,,
กินันทร์,สิรภัทรพงศ์,24000,,
นาสินพร,พลกานต์ธีรา,24000,,
ลามินกุล,รชเมธาอนันต์,24000,,
กิรินกุล,สิรเดชกิตติ,24000,,
วีลินทร์,ศรกานต์วิชัย,24000,,
ทาธินดา,ศรเรือนกิจ,24000,,
ลารินพร,วรวัฒน์กิจ,24000,,
ทาลินกุล,นภเดชวิชัย,24000,,
พาวินรักษ์,วรบูรณ์ศิริ,24000,,
ทามินรักษ์,ศรวัฒน์อนันต์,24000,,
สามินพร,นภเมธาธีรา,24000,,
นามินเทพ,นภเรือนอนันต์,24000,,
ทาวินพร,กฤภัทรพงศ์,24000,,
นาวินทร์,พลภัทรภาณุ,24110,,
ลาธีภา,ภรเมธาพงศ์,24110,,
ศิรินกุล,ชยเรือนธีรา,24110,,
นามินภา,สิรวัฒน์อนันต์,24110,,
มิธินสิทธิ์,กฤบูรณ์พงศ์,24110,,
ลาธินเทพ,ศรกานต์มงคล,24110,,
นาธินดา,ธรบูรณ์อนันต์,24110,,
นาภัคกุล,รชสิทธิ์กิจ,24110,,
ทาวินสิทธิ์,ภรโชติอนันต์,24110,,
พาลินพร,วรสิทธิ์มงคล,24110,,
รานันสิทธิ์,วรภัทรพงศ์,24110,,
พานันเทพ,รชเรือนอนันต์,24110,,
ราธินทร์,กฤกานต์อนันต์,24110,,
สานันนันท์,ธรวัฒน์อรุณ,24110,,
พามินพร,วรเดชอนันต์,24110,,
ทารัตรักษ์,ภรภัทรภาณุ,24110,,
กิวินนันท์,ภรไกรศิริ,24110,,
ศิธินรักษ์,ธรสิทธิ์กิจ,24110,,
ลาธินดา,รชภัทรอนันต์,24110,,
ทาสินรักษ์,วรสิทธิ์พงศ์,24110,,
ราธีพร,ศรบูรณ์ศิริ,24110,,
กิวินรักษ์,พลกานต์ธีรา,24110,,
มิมินกุล,กฤสิทธิ์อนันต์,24110,,
ราสินดา,รชบูรณ์อนันต์,24110,,
ราธินกุล,รชเดชศิริ,24110,,
นาธินพร,สิรกานต์อนันต์,24110,,
ลาสินดา,พลภัทรกิจ,24110,,
ศิวินนันท์,รชกานต์ศิริ,24110,,
รารินดา,กฤวัฒน์อรุณ,24110,,
สาภัคสิทธิ์,ชยวัฒน์อนันต์,24110,,
ลาธินดา,นภเรือนศิริ,24110,,
มิธีภา,กฤสิทธิ์กิจ,24110,,
ทาลินสิทธิ์,ศรไกรธีรา,24110,,
รารัตกุล,นภภัทรมงคล,24110,,
พาสินเทพ,ธรไกรธีรา,24130,,
ลาลินทร์,สิรวัฒน์ศิริ,24130,,
ราลินสิทธิ์,วรกานต์พงศ์,24130,,
สามินภา,ธรบูรณ์ธีรา,24130,,
ศิรัตนันท์,ภรกานต์ธีรา,24130,,
ศิรินชัย,สิรเดชพงศ์,24130,,
ราธินดา,กฤไกรกิตติ,24130,,
ราลินกุล,กฤเมธามงคล,24130,,
ทามินนันท์,ภรเมธาธีรา,24130,,
ศินันเทพ,ภรบูรณ์ธีรา,24130,,
กิธินเทพ,ธรวัฒน์กิจ,24130,,
นาสินทร์,ศรโชติมงคล,24130,,
นาธินเทพ,นภภัทรกิตติ,24130,,
ศิภัคนันท์,ศรเรือนภาณุ,24130,,
ราวินชัย,ภรวัฒน์กิจ,24130,,
สาธินภา,วรเมธาภาณุ,24130,,
ลานันชัย,ศรวัฒน์ศิริ,24130,,
ศิมินนันท์,สิรภัทรธีรา,24130,,
นาลินชัย,วรเดชอรุณ,24130,,
พาลินกุล,พลไกรศิริ,24130,,
สาลินเทพ,พลวัฒน์กิตติ,24130,,
พาสินพร,ศรโชติธีรา,24130,,
พาธีนันท์,ชยเรือนกิตติ,24130,,
วีสินภา,พลเดชกิตติ,24130,,
วีรัตเทพ,นภไกรอนันต์,24130,,
ทามินเทพ,ศรเรือนมงคล,24130,,
พานันรักษ์,วรภัทรอรุณ,24130,,
วีลินชัย,นภบูรณ์ภาณุ,24130,,
มิมินสิทธิ์,วรโชติมงคล,24130,,
วีสินดา,สิรเมธาศิริ,24130,,
ศิธินพร,ธรสิทธิ์มงคล,24130,,
กินันนันท์,รชเรือนกิจ,24130,,
วีรินภา,ธรเมธากิตติ,24130,,
นารินภา,ศรเดชภาณุ,25000,,
ศิลินทร์,ชยบูรณ์อรุณ,25000,,
นารัตเทพ,ชยเดชภาณุ,25000,,
นารินดา,นภเมธากิตติ,25000,,
ลารินดา,วรวัฒน์อรุณ,25000,,
มิธินเทพ,วรเมธาภาณุ,25000,,
มิมินเทพ,ศรกานต์ศิริ,25000,,
ศิมินพร,พลวัฒน์ภาณุ,25000,,
รานันกุล,กฤเดชกิตติ,25000,,
มิสินภา,พลบูรณ์ภาณุ,25000,,
สารัตรักษ์,ธรเรือนภาณุ,25000,,
มิรินพร,ธรภัทรธีรา,25000,,
ทารินเทพ,กฤบูรณ์อรุณ,25000,,
ศิรัตนันท์,กฤเรือนศิริ,25000,,
พาสินภา,สิรกานต์อนันต์,25000,,
มิภัคดา,พลภัทรศิริ,25000,,
สารินพร,ศรเมธาภาณุ,25000,,
ศิธีดา,ภรไกรภาณุ,25000,,
วีภัคภา,สิรเมธาวิชัย,25000,,
ศิรัตชัย,ธรไกรภาณุ,25000,,
พาภัคภา,กฤสิทธิ์อนันต์,25000,,
ทาธีกุล,ชยภัทรศิริ,25000,,
นาธีดา,วรสิทธิ์กิจ,25000,,
วีภัคกุล,ศรวัฒน์กิตติ,25000,,
สาภัครักษ์,นภไกรกิจ,25000,,
ลาธีดา,พลวัฒน์วิชัย,25000,,
ศิวินรักษ์,สิรไกรกิตติ,25000,,
สาวินดา,กฤไกรอนันต์,25000,,
ทารินสิทธิ์,ชยบูรณ์ภาณุ,25000,,
ศินันกุล,ศรเรือนศิริ,25000,,
นามินภา,รชกานต์มงคล,25000,,
สารัตทร์,สิรวัฒน์ภาณุ,25000,,
วีธินทร์,พลวัฒน์ศิริ,25000,,
ทาธินสิทธิ์,ภรบูรณ์ศิริ,25000,,
มิธินนันท์,ศรภัทรมงคล,26000,,
ศิรัตชัย,นภเรือนมงคล,26000,,
