FirstName,LastName,PostalCode,TrackingNo,Address
มิรัตภา,สิรไกรวิชัย,30220,,
กิธีชัย,สิรเดชศิริ,31000,,
รารินพร,รชเมธากิตติ,31000,,
ลาลินภา,ชยเรือนภาณุ,31000,,
พาสินสิทธิ์,ภรบูรณ์กิจ,31000,,
วีธีภา,กฤกานต์อรุณ,31000,,
ทาสินรักษ์,ศรภัทรกิจ,31000,,
สาธินชัย,รชเมธาธีรา,31000,,
พาธินทร์,วรไกรมงคล,31000,,
ทาสินทร์,ธรเมธาอนันต์,31000,,
มิมินดา,ภรเรือนธีรา,31000,,
สานันกุล,ธรโชติวิชัย,31000,,
กิสินเทพ,วรวัฒน์อรุณ,31000,,
ศิลินกุล,ชยเมธาภาณุ,31000,,
วีรินดา,ธรสิทธิ์ภาณุ,31000,,
รารัตดา,ภรเรือนภาณุ,31000,,
ทาธีรักษ์,รชบูรณ์กิตติ,31000,,
วีนันรักษ์,รชสิทธิ์กิจ,31000,,
กิธินชัย,วรเดชกิตติ,31000,,
สาภัคเทพ,นภเรือนวิชัย,31000,,
ราวินภา,ศรเดชธีรา,31000,,
พาวินภา,ศรสิทธิ์ธีรา,31000,,
วีธีภา,กฤเรือนวิชัย,31000,,
นารินรักษ์,สิรกานต์อรุณ,31000,,
ศิรัตชัย,สิรวัฒน์กิตติ,31000,,
นารัตทร์,นภบูรณ์อนันต์,31000,,
พาภัคสิทธิ์,ธรวัฒน์มงคล,31000,,
มินันเทพ,รชสิทธิ์ธีรา,31000,,
ลาลินเทพ,สิรเมธาอรุณ,31000,,
พารินพร,ศรบูรณ์กิตติ,31000,,
สานันชัย,ศรสิทธิ์กิตติ,31000,,
กิวินชัย,ศรเรือนภาณุ,31000,,
ทาภัครักษ์,ภรวัฒน์ภาณุ,31000,,
สานันเทพ,ชยบูรณ์พงศ์,31000,,
ศิมินเทพ,นภบูรณ์ธีรา,31000,,
ลารัตพร,รชกานต์ศิริ,31110,,
นารินทร์,กฤโชติศิริ,31110,,
สาวินชัย,นภไกรอรุณ,31110,,
นาภัคสิทธิ์,ศรเรือนกิจ,31110,,
สารัตภา,กฤวัฒน์วิชัย,31110,,
กินันนันท์,รชสิทธิ์พงศ์,31110,,
ลาธีรักษ์,รชเดชมงคล,31110,,
มิสินนันท์,กฤโชติธีรา,31110,,
พาวินสิทธิ์,กฤวัฒน์อนันต์,31110,,
วีรัตทร์,นภเมธาพงศ์,31110,,
นาวินสิทธิ์,วรกานต์อนันต์,31110,,
สารัตเทพ,กฤโชติวิชัย,31110,,
พาลินกุล,ธรวัฒน์ธีรา,31110,,
ลาภัครักษ์,สิรเดชวิชัย,31110,,
พารัตดา,สิรไกรกิจ,31110,,
วีภัคพร,ภรบูรณ์ศิริ,31110,,
ราสินสิทธิ์,นภวัฒน์อนันต์,31110,,
พารินชัย,วรกานต์วิชัย,31110,,
นาธินเทพ,สิรบูรณ์ศิริ,31110,,
ลามินชัย,สิรเดชพงศ์,31110,,
ราลินรักษ์,นภไกรกิจ,31110,,
ทาลินชัย,พลโชติมงคล,31110,,
ลาธินภา,กฤสิทธิ์วิชัย,31110,,
ทาธีภา,ชยเมธากิตติ,31110,,
ราสินทร์,กฤภัทรอนันต์,31110,,
กิธินกุล,วรเมธาธีรา,31110,,
ทารัตรักษ์,ชยกานต์พงศ์,31110,,
ทาธีพร,รชเมธากิตติ,31110,,
นานันพร,สิรวัฒน์ธีรา,31110,,
มิภัคภา,พลภัทรมงคล,31110,,
มิลินเทพ,ชยเมธากิตติ,31110,,
พารัตสิทธิ์,วรวัฒน์วิชัย,31110,,
ศินันทร์,ธรโชติกิจ,31110,,
ศิภัคเทพ,ชยไกรมงคล,31110,,
ราธินชัย,ชยสิทธิ์อนันต์,32000,,
สามินสิทธิ์,วรสิทธิ์กิตติ,32000,,
วีสินชัย,ธรบูรณ์พงศ์,32000,,
ศิรินรักษ์,ธรเรือนกิตติ,32000,,
นารินสิทธิ์,พลโชติอรุณ,32000,,
นารัตพร,รชเดชภาณุ,32000,,
ศินันสิทธิ์,นภเมธากิตติ,32000,,
ทาสินทร์,รชกานต์ธีรา,32000,,
ลาธินทร์,ภรไกรกิตติ,32000,,
พารินภา,รชสิทธิ์วิชัย,32000,,
พามินภา,ธรบูรณ์ศิริ,32000,,
สาลินรักษ์,สิรภัทรพงศ์,32000,,
ทานันเทพ,ชยบูรณ์พงศ์,32000,,
พามินกุล,กฤภัทรภาณุ,32000,,
พาธีภา,ชยไกรกิตติ,32000,,
ลาสินกุล,วรโชติกิตติ,32000,,
ราสินเทพ,กฤภัทรภาณุ,32000,,
พาธินดา,พลบูรณ์ศิริ,32000,,
สารินรักษ์,นภเรือนภาณุ,32000,,
วีธินนันท์,ศรเดชภาณุ,32000,,
นารินดา,กฤโชติพงศ์,32000,,
นาธินดา,รชโชติศิริ,32000,,
วีสินชัย,สิรเรือนพงศ์,32000,,
มิธีกุล,นภไกรธีรา,32000,,
มิรัตรักษ์,กฤโชติพงศ์,32000,,
พาธีสิทธิ์,ธรเมธาภาณุ,32000,,
วีรินพร,ธรบูรณ์อรุณ,32000,,
วีธีกุล,สิรเรือนศิริ,32000,,
ทานันดา,วรภัทรภาณุ,32000,,
มิธีพร,ชยบูรณ์ศิริ,32000,,
ศิวินดา,ภรเรือนมงคล,32000,,
กิสินภา,พลกานต์กิตติ,32000,,
พานันภา,ศรเดชภาณุ,32000,,
นาธินกุล,วรเดชกิจ,32000,,
มิลินทร์,รชบูรณ์อรุณ,32110,,
สาสินดา,วรสิทธิ์วิชัย,32110,,
มิสินกุล,กฤเมธาอนันต์,32110,,
กิมินรักษ์,พลภัทรภาณุ,32110,,
พาภัคชัย,กฤโชติพงศ์,32110,,
ลาสินสิทธิ์,รชบูรณ์วิชัย,32110,,
มิรินนันท์,ธรสิทธิ์ภาณุ,32110,,
ราภัคชัย,ธรโชติวิชัย,32110,,
สาธินรักษ์,วรกานต์อนันต์,32110,,
กิธีดา,กฤบูรณ์ภาณุ,32110,,
มิวินทร์,สิรไกรมงคล,32110,,
ราสินภา,กฤเดชมงคล,32110,,
ลาธีพร,ภรวัฒน์อรุณ,32110,,
มิรินพร,นภภัทรธีรา,32110,,
วีมินกุล,นภกานต์ภาณุ,32110,,
กิสินกุล,รชไกรอนันต์,32110,,
รามินดา,วรโชติธีรา,32110,,
ศิรัตรักษ์,วรวัฒน์อรุณ,32110,,
กิรินสิทธิ์,รชภัทรอนันต์,32110,,
มิธีชัย,ธรโชติกิจ,32110,,
สาลินทร์,ภรโชติธีรา,32110,,
มิลินกุล,สิรกานต์ภาณุ,32110,,
ทาวินเทพ,นภภัทรอรุณ,32110,,
วีลินพร,พลเรือนกิจ,32110,,
สารัตเทพ,ภรไกรมงคล,32110,,
พานันกุล,ชยไกรกิจ,32110,,
ทาวินภา,ภรกานต์ภาณุ,32110,,
พารัตสิทธิ์,ศรภัทรวิชัย,32110,,
สาวินพร,สิรเรือนอรุณ,32110,,
มินันดา,กฤภัทรกิตติ,32110,,
กิธีชัย,นภไกรภาณุ,32110,,
รารินรักษ์,วรเมธากิตติ,32110,,
นาลินกุล,ศรบูรณ์ธีรา,32110,,
ทาวินเทพ,ศรโชติอนันต์,32110,,
ทารัตนันท์,วรสิทธิ์วิชัย,33000,,
กิธินรักษ์,วรเรือนกิจ,33000,,
ศิรัตเทพ,กฤโชติอนันต์,33000,,
วีรัตชัย,ศรเมธาอรุณ,33000,,
นารินชัย,ภรสิทธิ์อรุณ,33000,,
นาสินทร์,นภวัฒน์ภาณุ,33000,,
นาสินพร,สิรภัทรอนันต์,33000,,
รารัตทร์,ธรเดชวิชัย,33000,,
พานันพร,พลวัฒน์ศิริ,33000,,
นาธินชัย,ชยบูรณ์อรุณ,33000,,
ทาภัครักษ์,นภเดชมงคล,33000,,
นานันภา,วรบูรณ์พงศ์,33000,,
นาวินสิทธิ์,สิรกานต์มงคล,33000,,
นาภัคทร์,ภรโชติอรุณ,33000,,
พาธีพร,พลภัทรธีรา,33000,,
นาลินดา,ภรภัทรอรุณ,33000,,
พารัตเทพ,รชโชติธีรา,33000,,
มินันกุล,ธรไกรภาณุ,33000,,
นาลินนันท์,ศรไกรอรุณ,33000,,
วีสินสิทธิ์,ธรเดชมงคล,33000,,
กิลินชัย,วรโชติมงคล,33000,,
กิรินสิทธิ์,รชกานต์พงศ์,33000,,
พาธีพร,ศรสิทธิ์พงศ์,33000,,
สาธีทร์,กฤเดชพงศ์,33000,,
ราลินภา,รชวัฒน์มงคล,33000,,
นารัตชัย,นภโชติอรุณ,33000,,
พามินพร,กฤเมธาภาณุ,33000,,
รารัตรักษ์,ภรเมธาธีรา,33000,,
ลาสินภา,ธรเดชกิจ,33000,,
รารินสิทธิ์,ภรไกรกิตติ,33000,,
วีรัตทร์,พลเดชมงคล,33000,,
ทานันกุล,ศรสิทธิ์อรุณ,33000,,
รามินสิทธิ์,ภรเมธากิตติ,33000,,
พาธีภา,กฤวัฒน์อนันต์,33110,,
พาสินเทพ,ศรกานต์กิจ,33110,,
ทาธินสิทธิ์,ภรโชติกิจ,33110,,
ลานันพร,วรภัทรพงศ์,33110,,
กิธินรักษ์,นภไกรกิจ,33110,,
วีรัตชัย,กฤไกรภาณุ,33110,,
ราธินทร์,วรเดชอรุณ,33110,,
วีธีกุล,พลโชติอนันต์,33110,,
วีรัตกุล,ธรเมธาอนันต์,33110,,
ลารัตเทพ,ชยเรือนพงศ์,33110,,
มิรินชัย,รชเมธาอนันต์,33110,,
รานันทร์,รชเดชอรุณ,33110,,
วีนันภา,นภเรือนอรุณ,33110,,
กิลินสิทธิ์,รชเรือนอรุณ,33110,,
กิวินภา,ชยบูรณ์ภาณุ,33110,,
ลารินภา,ชยไกรธีรา,33110,,
ศิสินชัย,กฤไกรวิชัย,33110,,
พานันทร์,สิรสิทธิ์อรุณ,33110,,
ทาสินดา,ธรโชติพงศ์,33110,,
กิรินภา,ธรภัทรวิชัย,33110,,
นาธีกุล,พลบูรณ์ศิริ,33110,,
ทารัตภา,นภเรือนธีรา,33110,,
ราสินเทพ,สิรไกรกิตติ,33110,,
วีสินกุล,รชเดชพงศ์,33110,,
วีนันกุล,รชกานต์พงศ์,33110,,
นาสินทร์,รชสิทธิ์ภาณุ,33110,,
กิวินสิทธิ์,พลเรือนอนันต์,33110,,
ทาวินนันท์,สิรโชติวิชัย,33110,,
ราสินภา,นภวัฒน์ธีรา,33110,,
มิลินพร,กฤไกรอนันต์,33110,,
นานันรักษ์,ศรสิทธิ์กิตติ,33110,,
ลานันสิทธิ์,นภเดชธีรา,33110,,
นาสินพร,ธรกานต์อนันต์,33110,,
ทาภัคนันท์,สิรเรือนมงคล,33120,,
ศิธีดา,พลเดชอนันต์,33120,,
นาสินพร,นภโชติอรุณ,33120,,
นาธีรักษ์,ศรวัฒน์ภาณุ,33120,,
ศิภัคนันท์,กฤภัทรอนันต์,33120,,
กิรินภา,ภรโชติภาณุ,33120,,
ศิธีรักษ์,ชยเรือนกิจ,33120,,
มิภัคทร์,กฤไกรศิริ,33120,,
นาลินดา,ชยบูรณ์ภาณุ,33120,,
มิธินนันท์,พลไกรธีรา,33120,,
สามินนันท์,ศรโชติกิจ,33120,,
ราธินสิทธิ์,นภกานต์ภาณุ,33120,,
ศิมินรักษ์,กฤกานต์วิชัย,33120,,
นานันดา,ชยวัฒน์วิชัย,33120,,
นาวินรักษ์,พลกานต์อรุณ,33120,,
นารัตทร์,รชเดชอนันต์,33120,,
กิภัคสิทธิ์,ศรบูรณ์ภาณุ,33120,,
ลาภัคกุล,ธรวัฒน์ธีรา,33120,,
พาภัคดา,กฤไกรกิจ,33120,,
ราลินพร,รชสิทธิ์ศิริ,33120,,
กิรินกุล,ธรสิทธิ์กิตติ,33120,,
นาธินพร,ภรโชติภาณุ,33120,,
ศิลินนันท์,ธรสิทธิ์กิจ,33120,,
ศิวินเทพ,ธรโชติวิชัย,33120,,
ศิภัครักษ์,สิรเรือนมงคล,33120,,
วีนันสิทธิ์,พลกานต์วิชัย,33120,,
รามินทร์,ธรเมธาภาณุ,33120,,
สาวินดา,วรบูรณ์กิตติ,33120,,
พาวินเทพ,กฤโชติวิชัย,33120,,
กิสินกุล,ภรกานต์อนันต์,33120,,
พาลินดา,วรสิทธิ์วิชัย,33120,,
มินันเทพ,ธรสิทธิ์พงศ์,33120,,
วีธินสิทธิ์,รชสิทธิ์ธีรา,33120,,
กิสินพร,รชเดชพงศ์,33140,,
กิภัครักษ์,นภบูรณ์มงคล,33140,,
นามินชัย,วรวัฒน์ศิริ,33140,,
กิธีนันท์,สิรไกรภาณุ,33140,,
กิมินสิทธิ์,ธรเรือนศิริ,33140,,
มิมินนันท์,พลสิทธิ์อรุณ,33140,,
นาลินนันท์,ธรบูรณ์กิตติ,33140,,
มิธีชัย,ชยบูรณ์วิชัย,33140,,
วีธีชัย,ภรภัทรวิชัย,33140,,
ลาวินกุล,ธรเมธาอนันต์,33140,,
สาวินดา,กฤโชติวิชัย,33140,,
สารัตดา,สิรภัทรวิชัย,33140,,
นาธินสิทธิ์,กฤภัทรภาณุ,33140,,
สาภัคดา,ศรกานต์กิจ,33140,,
สารินกุล,นภโชติกิจ,33140,,
พาสินสิทธิ์,ศรวัฒน์อรุณ,33140,,
กิวินรักษ์,วรวัฒน์ภาณุ,33140,,
มิรินนันท์,นภเมธาพงศ์,33140,,
สารินดา,ศรเมธาธีรา,33140,,
มิสินทร์,รชเรือนธีรา,33140,,
ลาธินทร์,รชเดชกิจ,33140,,
พาวินรักษ์,รชบูรณ์อนันต์,33140,,
ราธีภา,ชยเรือนกิจ,33140,,
วีวินดา,นภบูรณ์กิจ,33140,,
สาวินนันท์,วรภัทรภาณุ,33140,,
ลาลินพร,สิรกานต์ศิริ,33140,,
กิลินภา,กฤเดชอรุณ,33140,,
ทาวินนันท์,พลบูรณ์อนันต์,33140,,
วีวินชัย,วรสิทธิ์มงคล,33140,,
ลารินดา,ธรวัฒน์อรุณ,33140,,
พาภัคภา,ชยโชติศิริ,33140,,
ราภัคดา,พลสิทธิ์กิตติ,33140,,
กินันภา,ภรไกรพงศ์,33140,,
กินันกุล,พลภัทรอนันต์,34000,,
ราลินรักษ์,นภบูรณ์กิจ,34000,,
สามินพร,สิรเดชมงคล,34000,,
นารัตดา,สิรบูรณ์กิจ,34000,,
สาวินชัย,นภภัทรศิริ,34000,,
สาธินสิทธิ์,ศรเดชมงคล,34000,,
ราธินเทพ,ศรสิทธิ์ธีรา,34000,,
ศิรัตชัย,รชไกรกิตติ,34000,,
ทานันรักษ์,รชเมธากิจ,34000,,
มิธีทร์,รชสิทธิ์ธีรา,34000,,
มินันกุล,สิรสิทธิ์กิจ,34000,,
สาธินรักษ์,ศรไกรกิจ,34000,,
ทานันพร,พลโชติพงศ์,34000,,
สานันเทพ,สิรวัฒน์มงคล,34000,,
ศินันรักษ์,นภบูรณ์วิชัย,34000,,
ศิธินเทพ,สิรเดชกิจ,34000,,
ศิมินกุล,ศรวัฒน์พงศ์,34000,,
มิภัคดา,กฤเดชศิริ,34000,,
ลาสินทร์,กฤไกรวิชัย,34000,,
พารินดา,กฤเรือนอนันต์,34000,,
มิสินสิทธิ์,สิรเรือนพงศ์,34000,,
นานันดา,ภรสิทธิ์อรุณ,34000,,
กิวินพร,นภบูรณ์อนันต์,34000,,
ศิภัคกุล,วรเรือนมงคล,34000,,
ทาธีชัย,รชเมธามงคล,34000,,
นาลินรักษ์,กฤกานต์กิจ,34000,,
ลาธินพร,ธรเดชพงศ์,34000,,
ศิมินภา,พลภัทรศิริ,34000,,
นาวินเทพ,ภรกานต์ธีรา,34000,,
พานันภา,วรไกรกิตติ,34000,,
ทาภัคทร์,วรวัฒน์ภาณุ,34000,,
สานันทร์,ภรสิทธิ์กิตติ,34000,,
พาวินเทพ,นภไกรกิตติ,34000,,
วีวินกุล,ภรวัฒน์วิชัย,34110,,
พาสินกุล,ภรเรือนพงศ์,34110,,
พาภัคดา,พลภัทรกิจ,34110,,
พาธินรักษ์,ชยโชติธีรา,34110,,
ศิลินภา,พลไกรพงศ์,34110,,
นาสินดา,ภรวัฒน์ธีรา,34110,,
รารินรักษ์,สิรภัทรอนันต์,34110,,
ลารินเทพ,ธรเรือนกิตติ,34110,,
นาภัคนันท์,นภไกรวิชัย,34110,,
กิมินรักษ์,กฤบูรณ์ศิริ,34110,,
ทาธีทร์,ชยเมธาศิริ,34110,,
ลารัตดา,วรไกรธีรา,34110,,
ศินันดา,ชยโชติธีรา,34110,,
สามินพร,ภรวัฒน์วิชัย,34110,,
กิมินชัย,กฤบูรณ์กิจ,34110,,
ทาลินรักษ์,ภรกานต์วิชัย,34110,,
สารัตกุล,วรเมธาพงศ์,34110,,
พามินชัย,กฤไกรพงศ์,34110,,
ศิรินชัย,นภไกรศิริ,34110,,
ลานันพร,วรไกรวิชัย,34110,,
ศิรัตทร์,ภรไกรกิจ,34110,,
วีมินภา,ชยกานต์ศิริ,34110,,
ทาลินนันท์,สิรสิทธิ์ศิริ,34110,,
สาลินทร์,ภรบูรณ์ศิริ,34110,,
วีรัตรักษ์,พลเรือนอรุณ,34110,,
รานันดา,นภวัฒน์พงศ์,34110,,
สานันพร,ศรสิทธิ์อนันต์,34110,,
พาสินนันท์,พลกานต์ธีรา,34110,,
พาสินพร,ชยวัฒน์กิตติ,34110,,
สามินชัย,ชยเรือนพงศ์,34110,,
สาธีเทพ,ธรกานต์ศิริ,34110,,
กิมินนันท์,วรโชติอรุณ,34110,,
นาธินชัย,นภโชติอนันต์,34110,,
กิธีดา,สิรกานต์ศิริ,34160,,
พาวินเทพ,วรโชติอนันต์,34160,,
นามินชัย,รชบูรณ์กิจ,34160,,
ทารัตเทพ,ชยกานต์อรุณ,34160,,
มิวินกุล,วรภัทรธีรา,34160,,
นาธีสิทธิ์,รชวัฒน์กิตติ,34160,,
ศิลินพร,ภรเรือนอนันต์,34160,,
กิวินภา,วรไกรวิชัย,34160,,
วีรัตกุล,รชวัฒน์กิตติ,34160,,
ทาวินกุล,ศรสิทธิ์อรุณ,34160,,
ทาวินสิทธิ์,ภรวัฒน์พงศ์,34160,,
สาธีสิทธิ์,ธรวัฒน์ธีรา,34160,,
วีนันพร,รชเดชมงคล,34160,,
ลาสินทร์,วรเดชกิจ,34160,,
พาธินรักษ์,ชยสิทธิ์ธีรา,34160,,
นาธินเทพ,ธรภัทรกิจ,34160,,
วีภัคสิทธิ์,ธรโชติอรุณ,34160,,
วีภัคชัย,ภรเรือนวิชัย,34160,,
วีลินสิทธิ์,ชยโชติมงคล,34160,,
มิภัคนันท์,พลบูรณ์วิชัย,34160,,
นาธีดา,สิรเรือนวิชัย,34160,,
ลาธีนันท์,สิรสิทธิ์พงศ์,34160,,
สาภัคทร์,พลเมธาอนันต์,34160,,
สารินกุล,นภสิทธิ์พงศ์,34160,,
ลาวินทร์,รชเดชศิริ,34160,,
กิภัคชัย,วรไกรศิริ,34160,,
วีสินภา,นภไกรอรุณ,34160,,
พารัตเทพ,ศรเรือนพงศ์,34160,,
ศิวินพร,ภรบูรณ์มงคล,34160,,
นาวินนันท์,กฤบูรณ์ศิริ,34160,,
ลาภัคทร์,วรบูรณ์ศิริ,34160,,
พารินภา,นภเมธาภาณุ,34160,,
ศิมินชัย,สิรภัทรศิริ,34160,,
นาวินทร์,ธรวัฒน์วิชัย,34190,,
ลารินกุล,ชยโชติอรุณ,34190,,
ทามินภา,รชกานต์กิตติ,34190,,
พาสินชัย,รชบูรณ์ศิริ,34190,,
พาสินภา,ศรบูรณ์พงศ์,34190,,
ราธีดา,ธรภัทรวิชัย,34190,,
มิรินรักษ์,รชเดชศิริ,34190,,
ลาภัคชัย,ศรภัทรพงศ์,34190,,
นาสินชัย,สิรวัฒน์ภาณุ,34190,,
วีธีภา,ศรบูรณ์ธีรา,34190,,
ทาภัคดา,กฤภัทรพงศ์,34190,,
นาธีเทพ,ชยสิทธิ์กิตติ,34190,,
