FirstName,LastName,PostalCode,TrackingNo,Address
ศิสินเทพ,กฤกานต์ธีรา,10510,,
มิวินภา,นภโชติมงคล,10510,,
กิวินรักษ์,ธรไกรศิริ,10510,,
ลารัตชัย,ธรวัฒน์ธีรา,10510,,
นารัตพร,พลบูรณ์อนันต์,10510,,
วีสินดา,นภเรือนพงศ์,10510,,
กิมินทร์,นภสิทธิ์อนันต์,10510,,
รานันเทพ,กฤกานต์ธีรา,10510,,
สารินรักษ์,สิรเมธาศิริ,10510,,
วีรินทร์,ศรบูรณ์มงคล,10510,,
นาธีนันท์,ธรภัทรธีรา,10510,,
มิมินนันท์,สิรไกรพงศ์,10510,,
ทามินกุล,รชวัฒน์อนันต์,10510,,
มินันนันท์,ศรกานต์วิชัย,10510,,
ราสินทร์,วรไกรพงศ์,10510,,
รานันทร์,พลวัฒน์ธีรา,10510,,
ลารัตทร์,ศรกานต์อนันต์,10510,,
วีมินนันท์,ภรบูรณ์ศิริ,10510,,
ศิลินทร์,พลบูรณ์กิตติ,10510,,
มิภัคนันท์,พลสิทธิ์ธีรา,10510,,
ลามินพร,ธรโชติวิชัย,10510,,
นารัตดา,ภรสิทธิ์กิจ,10510,,
ทารัตรักษ์,ธรเดชอนันต์,10510,,
วีมินสิทธิ์,รชเรือนศิริ,10510,,
กิลินเทพ,กฤกานต์ธีรา,10510,,
พาสินรักษ์,วรเดชอรุณ,10510,,
สาวินภา,ชยกานต์ศิริ,10510,,
สามินสิทธิ์,วรโชติมงคล,10510,,
วีนันพร,กฤโชติภาณุ,10510,,
มิธินกุล,สิรวัฒน์กิจ,10510,,
สารินกุล,รชกานต์ธีรา,10510,,
ศินันภา,ธรกานต์ศิริ,10510,,
ทาลินนันท์,นภภัทรวิชัย,10510,,
ทารินนันท์,สิรเดชกิจ,10520,,
มิธีกุล,ศรไกรธีรา,10520,,
ศิวินดา,พลวัฒน์อนันต์,10520,,
สารินเทพ,พลวัฒน์กิตติ,10520,,
ทาสินสิทธิ์,นภวัฒน์อนันต์,10520,,
ราภัคภา,ธรเดชวิชัย,10520,,
ทานันภา,ศรโชติพงศ์,10520,,
สาธินดา,ชยบูรณ์ศิริ,10520,,
ลาวินดา,ชยกานต์ศิริ,10520,,
มิภัคสิทธิ์,ศรวัฒน์มงคล,10520,,
พาลินกุล,ธรเรือนวิชัย,10520,,
ศิธินกุล,กฤโชติกิตติ,10520,,
วีรินนันท์,พลเรือนศิริ,10520,,
มิภัคพร,ธรวัฒน์อรุณ,10520,,
พารัตเทพ,รชเดชศิริ,10520,,
กิลินพร,พลเมธาธีรา,10520,,
ศิรินภา,รชสิทธิ์ศิริ,10520,,
พาลินภา,พลเดชศิริ,10520,,
นาธีเทพ,วรบูรณ์อรุณ,10520,,
นาสินสิทธิ์,พลภัทรกิจ,10520,,
วีรัตกุล,สิรภัทรกิจ,10520,,
นาธินพร,ศรสิทธิ์ธีรา,10520,,
กิภัคพร,สิรสิทธิ์กิตติ,10520,,
วีภัคสิทธิ์,วรภัทรอนันต์,10520,,
ทารัตภา,พลบูรณ์กิจ,10520,,
ลาธินภา,ภรเดชกิจ,10520,,
มิธินภา,วรบูรณ์วิชัย,10520,,
พาภัคชัย,รชกานต์มงคล,10520,,
กิรัตรักษ์,ชยเรือนวิชัย,10520,,
ทาสินภา,กฤเดชศิริ,10520,,
ศินันเทพ,นภเรือนศิริ,10520,,
ราภัคดา,ภรเรือนอนันต์,10520,,
พานันชัย,รชไกรศิริ,10520,,
ทานันเทพ,รชเดชกิจ,10520,,
ราสินเทพ,รชกานต์มงคล,10530,,
มิภัคนันท์,พลโชติกิตติ,10530,,
ทารินพร,ศรไกรอนันต์,10530,,
ลารินภา,รชบูรณ์อนันต์,10530,,
ลาภัคเทพ,ภรโชติกิจ,10530,,
พารัตดา,นภไกรอรุณ,10530,,
ลามินชัย,พลกานต์มงคล,10530,,
พาภัคทร์,ศรไกรวิชัย,10530,,
ศิสินนันท์,ภรสิทธิ์ศิริ,10530,,
กิธินรักษ์,ชยไกรภาณุ,10530,,
กินันเทพ,ภรสิทธิ์ศิริ,10530,,
วีภัคภา,รชเรือนมงคล,10530,,
ลาลินทร์,ชยสิทธิ์ธีรา,10530,,
นาวินรักษ์,สิรวัฒน์ศิริ,10530,,
ทาสินรักษ์,พลเมธาอรุณ,10530,,
นาธินชัย,พลเมธาอนันต์,10530,,
ศิสินเทพ,ธรเดชอรุณ,10530,,
พาลินรักษ์,นภโชติศิริ,10530,,
กิภัคสิทธิ์,กฤวัฒน์วิชัย,10530,,
ราภัครักษ์,กฤวัฒน์วิชัย,10530,,
วีธีพร,พลกานต์มงคล,10530,,
กินันภา,ธรวัฒน์วิชัย,10530,,
สานันภา,ภรบูรณ์ภาณุ,10530,,
ทารินดา,รชไกรธีรา,10530,,
พาลินดา,สิรภัทรภาณุ,10530,,
ทามินทร์,รชเดชวิชัย,10530,,
นาธีรักษ์,สิรบูรณ์วิชัย,10530,,
ศิสินกุล,ธรภัทรพงศ์,10530,,
กิภัคทร์,พลไกรกิจ,10530,,
สาธีภา,ศรวัฒน์อรุณ,10530,,
กิลินเทพ,ธรเมธาวิชัย,10530,,
ลาธีรักษ์,ภรวัฒน์วิชัย,10530,,
วีธีกุล,ธรสิทธิ์อรุณ,10530,,
ศิรัตทร์,ชยวัฒน์พงศ์,10530,,
มิมินรักษ์,วรกานต์มงคล,10540,,
ลามินเทพ,ธรบูรณ์ธีรา,10540,,
สามินทร์,ภรโชติกิจ,10540,,
วีธีสิทธิ์,กฤสิทธิ์อนันต์,10540,,
พาภัคเทพ,ชยไกรมงคล,10540,,
วีรินเทพ,พลเรือนกิจ,10540,,
วีธินชัย,ชยภัทรพงศ์,10540,,
กิมินกุล,ภรเดชพงศ์,10540,,
รามินกุล,พลไกรศิริ,10540,,
ลาลินเทพ,พลเมธาภาณุ,10540,,
ลาธีพร,รชวัฒน์อนันต์,10540,,
มิสินเทพ,รชเดชอรุณ,10540,,
รามินรักษ์,รชภัทรอรุณ,10540,,
พาธีชัย,วรเมธาอรุณ,10540,,
กิสินสิทธิ์,สิรวัฒน์กิจ,10540,,
ราธินดา,ธรเมธาพงศ์,10540,,
สาภัครักษ์,ชยสิทธิ์ศิริ,10540,,
ศิมินรักษ์,ศรโชติอนันต์,10540,,
กิภัคชัย,ภรภัทรวิชัย,10540,,
กิมินภา,กฤเมธาอนันต์,10540,,
พาธีชัย,รชไกรพงศ์,10540,,
ลาธีทร์,ธรโชติศิริ,10540,,
วีภัคชัย,วรกานต์กิจ,10540,,
ลาวินเทพ,ศรเมธาภาณุ,10540,,
พานันสิทธิ์,สิรโชติมงคล,10540,,
นาธีรักษ์,ชยไกรอนันต์,10540,,
มิภัครักษ์,รชบูรณ์มงคล,10540,,
สามินพร,กฤสิทธิ์อรุณ,10540,,
ทารินเทพ,วรไกรธีรา,10540,,
ลาธีกุล,วรกานต์อรุณ,10540,,
ลาธีภา,สิรเรือนศิริ,10540,,
ศิรินชัย,ภรเรือนพงศ์,10540,,
สารินเทพ,สิรวัฒน์อรุณ,10540,,
ทาวินพร,กฤภัทรวิชัย,10540,,
วีรัตเทพ,ศรบูรณ์ศิริ,10550,,
ศิธีนันท์,นภโชติกิจ,10550,,
รารัตนันท์,กฤวัฒน์ศิริ,10550,,
ศิสินชัย,นภภัทรภาณุ,10550,,
วีภัคกุล,นภไกรพงศ์,10550,,
วีธินดา,รชสิทธิ์กิตติ,10550,,
สาลินเทพ,กฤโชติพงศ์,10550,,
ทาวินชัย,ชยบูรณ์ศิริ,10550,,
วีรินดา,สิรภัทรกิตติ,10550,,
พาลินภา,นภบูรณ์วิชัย,10550,,
ศิลินพร,รชภัทรกิตติ,10550,,
กิลินเทพ,กฤไกรกิจ,10550,,
ศิลินสิทธิ์,ธรเมธาอรุณ,10550,,
สาสินทร์,ศรเมธากิจ,10550,,
กิรัตดา,รชวัฒน์พงศ์,10550,,
กิลินทร์,นภโชติอนันต์,10550,,
ลาธีทร์,สิรเรือนอรุณ,10550,,
ทารินทร์,วรโชติกิจ,10550,,
ลามินทร์,กฤกานต์อรุณ,10550,,
ลานันพร,สิรไกรอนันต์,10550,,
มิธินดา,สิรสิทธิ์อนันต์,10550,,
มิธินพร,ธรเมธาศิริ,10550,,
ทาภัคนันท์,ธรภัทรธีรา,10550,,
ลารินภา,ภรเมธาภาณุ,10550,,
นามินพร,นภโชติอรุณ,10550,,
ราลินภา,นภเดชกิตติ,10550,,
ศิรินดา,ชยบูรณ์กิตติ,10550,,
วีสินเทพ,นภสิทธิ์ศิริ,10550,,
ราสินภา,พลไกรมงคล,10550,,
พาธินเทพ,ชยไกรศิริ,10550,,
พาลินกุล,นภภัทรพงศ์,10550,,
สามินภา,ธรโชติวิชัย,10550,,
ราวินสิทธิ์,สิรเมธากิตติ,10550,,
วีธีเทพ,ภรเรือนวิชัย,10550,,
ลาธีเทพ,กฤบูรณ์วิชัย,10560,,
พารินดา,สิรเดชอรุณ,10560,,
ทารินรักษ์,รชโชติกิตติ,10560,,
กิรัตชัย,ภรสิทธิ์กิจ,10560,,
ทาธีดา,ศรเมธาภาณุ,10560,,
ลาวินภา,พลไกรมงคล,10560,,
นาสินรักษ์,รชสิทธิ์ธีรา,10560,,
สารัตรักษ์,ศรเมธากิตติ,10560,,
นาวินเทพ,พลกานต์อนันต์,10560,,
พารินชัย,พลไกรศิริ,10560,,
นารินดา,ภรวัฒน์อนันต์,10560,,
นาธินกุล,กฤเดชพงศ์,10560,,
ราลินชัย,พลโชติอรุณ,10560,,
วีสินชัย,ธรกานต์พงศ์,10560,,
ศิธีชัย,ธรเดชอรุณ,10560,,
สาลินภา,สิรภัทรวิชัย,10560,,
วีภัคภา,นภบูรณ์กิจ,10560,,
ศิวินกุล,รชเรือนกิตติ,10560,,
ทามินเทพ,ธรวัฒน์วิชัย,10560,,
วีนันรักษ์,กฤไกรพงศ์,10560,,
ศิธีพร,นภสิทธิ์อรุณ,10560,,
ทาธีเทพ,พลบูรณ์กิจ,10560,,
สารัตสิทธิ์,นภเมธากิจ,10560,,
ทาวินเทพ,ธรบูรณ์วิชัย,10560,,
วีมินนันท์,ภรเมธากิจ,10560,,
วีธีนันท์,ภรโชติศิริ,10560,,
ทาลินพร,ภรวัฒน์ภาณุ,10560,,
ลามินภา,ภรเมธาวิชัย,10560,,
มินันสิทธิ์,ศรสิทธิ์อนันต์,10560,,
รารินชัย,ศรเมธาอนันต์,10560,,
วีลินพร,กฤกานต์ภาณุ,10560,,
พาภัครักษ์,ภรโชติวิชัย,10560,,
พารัตภา,ชยไกรธีรา,10560,,
ราลินภา,พลไกรกิตติ,10560,,
วีภัคกุล,สิรสิทธิ์กิตติ,10570,,
สารินชัย,กฤเมธาอรุณ,10570,,
ราสินรักษ์,นภบูรณ์กิตติ,10570,,
ทามินทร์,ชยสิทธิ์อรุณ,10570,,
พาธินทร์,สิรสิทธิ์กิตติ,10570,,
มิภัคนันท์,สิรสิทธิ์พงศ์,10570,,
รามินสิทธิ์,สิรบูรณ์กิตติ,10570,,
พามินเทพ,พลโชติศิริ,10570,,
กิรัตรักษ์,ศรโชติกิจ,10570,,
พารัตทร์,ชยภัทรภาณุ,10570,,
ทาวินพร,พลสิทธิ์อรุณ,10570,,
นาสินทร์,รชภัทรอรุณ,10570,,
ลาธินกุล,สิรไกรภาณุ,10570,,
รามินกุล,วรเดชพงศ์,10570,,
มิรินสิทธิ์,ธรบูรณ์พงศ์,10570,,
ทารินดา,วรเรือนอนันต์,10570,,
รานันทร์,ภรเรือนภาณุ,10570,,
นารินกุล,นภภัทรกิจ,10570,,
สารัตดา,รชโชติศิริ,10570,,
ราภัคภา,สิรภัทรธีรา,10570,,
มิภัครักษ์,พลเดชพงศ์,10570,,
กิสินภา,นภเมธาธีรา,10570,,
นาสินพร,กฤบูรณ์พงศ์,10570,,
ศิธีทร์,สิรสิทธิ์ศิริ,10570,,
นาภัคพร,ศรเมธาพงศ์,10570,,
กิธินภา,ชยโชติกิจ,10570,,
ทารินชัย,ธรเดชวิชัย,10570,,
พานันกุล,กฤเมธาอรุณ,10570,,
ราภัคนันท์,ภรเมธาศิริ,10570,,
ราภัครักษ์,นภภัทรอรุณ,10570,,
ศิมินนันท์,สิรไกรภาณุ,10570,,
สารัตนันท์,กฤบูรณ์อรุณ,10570,,
ราสินดา,สิรกานต์ศิริ,10570,,
ราภัครักษ์,ภรภัทรศิริ,10570,,
ราวินกุล,นภภัทรกิตติ,10600,,
ราธีภา,สิรเมธาภาณุ,10600,,
สารัตสิทธิ์,กฤโชติวิชัย,10600,,
พาสินภา,พลวัฒน์กิตติ,10600,,
สาวินกุล,ชยวัฒน์กิตติ,10600,,
มินันดา,สิรบูรณ์ภาณุ,10600,,
ราภัคพร,วรวัฒน์วิชัย,10600,,
พารัตรักษ์,วรไกรมงคล,10600,,
สาธีดา,ศรกานต์อนันต์,10600,,
มินันรักษ์,นภกานต์อนันต์,10600,,
สาลินพร,พลบูรณ์อรุณ,10600,,
ราภัคทร์,วรเมธากิจ,10600,,
กิวินทร์,สิรไกรศิริ,10600,,
ลานันรักษ์,กฤกานต์วิชัย,10600,,
ราธินทร์,ธรเดชภาณุ,10600,,
ลานันภา,นภเมธากิจ,10600,,
ทาธินนันท์,กฤโชติอรุณ,10600,,
สาภัคดา,วรเมธาธีรา,10600,,
ศิลินดา,กฤภัทรพงศ์,10600,,
มิภัคพร,สิรไกรภาณุ,10600,,
ศิภัคกุล,สิรโชติอนันต์,10600,,
กิวินชัย,ชยวัฒน์กิตติ,10600,,
กิภัคกุล,พลโชติกิตติ,10600,,
พารัตทร์,นภไกรพงศ์,10600,,
มิลินกุล,ชยกานต์มงคล,10600,,
มิรินรักษ์,ธรกานต์ศิริ,10600,,
พาสินทร์,วรโชติธีรา,10600,,
กิธินภา,ธรโชติอรุณ,10600,,
พารินภา,นภบูรณ์มงคล,10600,,
ศิธินรักษ์,วรไกรกิจ,10600,,
กิมินดา,พลกานต์ภาณุ,10600,,
นาวินดา,รชกานต์พงศ์,10600,,
ศิวินรักษ์,นภเรือนกิจ,10600,,
ลาธินกุล,ภรเดชอรุณ,10600,,
ศิมินนันท์,นภเรือนกิตติ,10700,,
สารัตรักษ์,รชเรือนอรุณ,10700,,
กิมินรักษ์,ธรวัฒน์กิตติ,10700,,
มิสินชัย,กฤวัฒน์มงคล,10700,,
ศิวินเทพ,รชบูรณ์ศิริ,10700,,
สาธีชัย,รชโชติวิชัย,10700,,
วีมินสิทธิ์,ชยเดชกิตติ,10700,,
ราธีสิทธิ์,รชไกรวิชัย,10700,,
กิภัคนันท์,ธรวัฒน์วิชัย,10700,,
สาลินสิทธิ์,พลกานต์อนันต์,10700,,
รารัตภา,ธรสิทธิ์กิจ,10700,,
วีรัตภา,ธรสิทธิ์ศิริ,10700,,
สารัตกุล,สิรเมธากิตติ,10700,,
นารินชัย,กฤกานต์พงศ์,10700,,
มิรินภา,สิรเดชพงศ์,10700,,
ลารินดา,พลเมธาศิริ,10700,,
สาสินนันท์,รชไกรพงศ์,10700,,
วีธีทร์,สิรกานต์มงคล,10700,,
วีสินภา,กฤเรือนกิตติ,10700,,
มิรินภา,ธรภัทรพงศ์,10700,,
วีมินกุล,ธรบูรณ์อนันต์,10700,,
กิภัคเทพ,ธรโชติภาณุ,10700,,
พาธีรักษ์,วรบูรณ์มงคล,10700,,
นาธินรักษ์,วรกานต์อรุณ,10700,,
รารัตเทพ,ชยไกรอนันต์,10700,,
รารัตภา,ศรวัฒน์ธีรา,10700,,
นาลินดา,ชยกานต์กิจ,10700,,
วีนันสิทธิ์,ธรบูรณ์อนันต์,10700,,
นารัตพร,พลวัฒน์มงคล,10700,,
ศิรัตภา,รชบูรณ์วิชัย,10700,,
ลามินรักษ์,ภรเรือนกิจ,10700,,
มิลินสิทธิ์,รชวัฒน์ธีรา,10700,,
มิภัคพร,วรเมธาอรุณ,10700,,
ลามินกุล,กฤเมธากิตติ,10700,,
ลารินพร,รชเดชวิชัย,10800,,
ศิภัคชัย,ชยภัทรอนันต์,10800,,
พาลินชัย,วรภัทรกิจ,10800,,
ศิรัตเทพ,ธรเรือนอรุณ,10800,,
ลานันสิทธิ์,รชเดชวิชัย,10800,,
นารินกุล,สิรไกรภาณุ,10800,,
ราลินนันท์,วรบูรณ์วิชัย,10800,,
มินันดา,นภเรือนธีรา,10800,,
พาธีดา,ชยกานต์กิจ,10800,,
สารัตนันท์,กฤสิทธิ์กิตติ,10800,,
วีมินทร์,สิรไกรพงศ์,10800,,
วีภัคพร,ศรไกรกิตติ,10800,,
ราสินสิทธิ์,สิรวัฒน์อนันต์,10800,,
ศิรินสิทธิ์,ภรโชติธีรา,10800,,
ราวินรักษ์,ภรเมธามงคล,10800,,
พาธินพร,รชบูรณ์กิจ,10800,,
ศินันกุล,กฤโชติภาณุ,10800,,
ทาสินเทพ,วรไกรศิริ,10800,,
รารินสิทธิ์,ภรเรือนอนันต์,10800,,
ลามินสิทธิ์,ภรเรือนกิจ,10800,,
ศิรินรักษ์,ภรเดชศิริ,10800,,
พาลินทร์,ภรเรือนอรุณ,10800,,
ทาธินสิทธิ์,วรเดชวิชัย,10800,,
สาธินนันท์,รชวัฒน์กิตติ,10800,,
ศิภัคเทพ,รชเรือนอรุณ,10800,,
วีรัตทร์,ภรไกรมงคล,10800,,
ลาสินภา,ภรไกรอรุณ,10800,,
รารินทร์,นภโชติพงศ์,10800,,
ลาภัคชัย,วรเดชธีรา,10800,,
มิธินกุล,กฤเดชภาณุ,10800,,
พานันสิทธิ์,สิรวัฒน์ศิริ,10800,,
วีวินทร์,ธรเรือนภาณุ,10800,,
ทารินรักษ์,รชภัทรกิตติ,10800,,
ลารัตดา,ธรเมธาอรุณ,10800,,
วีสินสิทธิ์,ภรเรือนศิริ,10900,,
สาธีเทพ,พลสิทธิ์ภาณุ,10900,,
ลามินชัย,ธรไกรอนันต์,10900,,
ทาธีพร,วรไกรพงศ์,10900,,
ราสินเทพ,ธรเรือนศิริ,10900,,
วีมินเทพ,ธรเรือนศิริ,10900,,
สาธินพร,ธรเดชศิริ,10900,,
ทาธินกุล,ศรภัทรกิจ,10900,,
กินันชัย,นภสิทธิ์ศิริ,10900,,
ลาสินทร์,ศรสิทธิ์พงศ์,10900,,
รารัตดา,ชยบูรณ์กิตติ,10900,,
พาลินเทพ,กฤไกรวิชัย,10900,,
วีธินภา,ธรเรือนวิชัย,10900,,
ลาลินทร์,ศรโชติกิจ,10900,,
สาธีพร,ศรโชติพงศ์,10900,,
พารินชัย,ภรภัทรภาณุ,10900,,
นานันนันท์,นภกานต์ศิริ,10900,,
มิภัคทร์,ธรกานต์ธีรา,10900,,
นาสินพร,ศรภัทรภาณุ,10900,,
มิรัตดา,กฤเรือนศิริ,10900,,
พาสินภา,ศรบูรณ์กิตติ,10900,,
สาลินชัย,ภรวัฒน์กิตติ,10900,,
นาธินสิทธิ์,ศรเมธาอรุณ,10900,,
ลารัตสิทธิ์,พลเมธามงคล,10900,,
ทาสินรักษ์,พลวัฒน์ธีรา,10900,,
วีมินดา,ธรเรือนกิตติ,10900,,
นารินพร,ธรไกรมงคล,10900,,
สาธีสิทธิ์,พลบูรณ์อนันต์,10900,,
นาวินชัย,นภกานต์ธีรา,10900,,
ทารัตเทพ,กฤเรือนกิจ,10900,,
ราธีกุล,ชยไกรภาณุ,10900,,
มิรินภา,รชสิทธิ์อรุณ,10900,,
รานันนันท์,ชยกานต์ภาณุ,10900,,
พารินสิทธิ์,รชภัทรธีรา,10900,,
มินันรักษ์,ชยกานต์ภาณุ,11000,,
ลานันสิทธิ์,กฤโชติพงศ์,11000,,
พาสินชัย,รชวัฒน์อนันต์,11000,,
ทารินสิทธิ์,สิรภัทรอนันต์,11000,,
ลานันนันท์,นภสิทธิ์ศิริ,11000,,
ลานันรักษ์,ศรไกรพงศ์,11000,,
กิลินเทพ,ธรโชติพงศ์,11000,,
