FirstName,LastName,PostalCode,TrackingNo,Address
สาภัคดา,วรเมธาธีรา,10600,,
ศิลินดา,กฤภัทรพงศ์,10600,,
มิภัคพร,สิรไกรภาณุ,10600,,
ศิภัคกุล,สิรโชติอนันต์,10600,,
กิวินชัย,ชยวัฒน์กิตติ,10600,,
กิภัคกุล,พลโชติกิตติ,10600,,
พารัตทร์,นภไกรพงศ์,10600,,
มิลินกุล,ชยกานต์มงคล,10600,,
มิรินรักษ์,ธรกานต์ศิริ,10600,,
พาสินทร์,วรโชติธีรา,10600,,
กิธินภา,ธรโชติอรุณ,10600,,
พารินภา,นภบูรณ์มงคล,10600,,
ศิธินรักษ์,วรไกรกิจ,10600,,
กิมินดา,พลกานต์ภาณุ,10600,,
นาวินดา,รชกานต์พงศ์,10600,,
ศิวินรักษ์,นภเรือนกิจ,10600,,
ลาธินกุล,ภรเดชอรุณ,10600,,
ศิมินนันท์,นภเรือนกิตติ,10700,,
สารัตรักษ์,รชเรือนอรุณ,10700,,
กิมินรักษ์,ธรวัฒน์กิตติ,10700,,
มิสินชัย,กฤวัฒน์มงคล,10700,,
ศิวินเทพ,รชบูรณ์ศิริ,10700,,
สาธีชัย,รชโชติวิชัย,10700,,
วีมินสิทธิ์,ชยเดชกิตติ,10700,,
ราธีสิทธิ์,รชไกรวิชัย,10700,,
กิภัคนันท์,ธรวัฒน์วิชัย,10700,,
สาลินสิทธิ์,พลกานต์อนันต์,10700,,
รารัตภา,ธรสิทธิ์กิจ,10700,,
วีรัตภา,ธรสิทธิ์ศิริ,10700,,
สารัตกุล,สิรเมธากิตติ,10700,,
นารินชัย,กฤกานต์พงศ์,10700,,
มิรินภา,สิรเดชพงศ์,10700,,
ลารินดา,พลเมธาศิริ,10700,,
สาสินนันท์,รชไกรพงศ์,10700,,
วีธีทร์,สิรกานต์มงคล,10700,,
วีสินภา,กฤเรือนกิตติ,10700,,
มิรินภา,ธรภัทรพงศ์,10700,,
วีมินกุล,ธรบูรณ์อนันต์,10700,,
กิภัคเทพ,ธรโชติภาณุ,10700,,
พาธีรักษ์,วรบูรณ์มงคล,10700,,
นาธินรักษ์,วรกานต์อรุณ,10700,,
รารัตเทพ,ชยไกรอนันต์,10700,,
รารัตภา,ศรวัฒน์ธีรา,10700,,
นาลินดา,ชยกานต์กิจ,10700,,
วีนันสิทธิ์,ธรบูรณ์อนันต์,10700,,
นารัตพร,พลวัฒน์มงคล,10700,,
ศิรัตภา,รชบูรณ์วิชัย,10700,,
ลามินรักษ์,ภรเรือนกิจ,10700,,
มิลินสิทธิ์,รชวัฒน์ธีรา,10700,,
มิภัคพร,วรเมธาอรุณ,10700,,
ลามินกุล,กฤเมธากิตติ,10700,,
ลารินพร,รชเดชวิชัย,10800,,
ศิภัคชัย,ชยภัทรอนันต์,10800,,
พาลินชัย,วรภัทรกิจ,10800,,
ศิรัตเทพ,ธรเรือนอรุณ,10800,,
ลานันสิทธิ์,รชเดชวิชัย,10800,,
นารินกุล,สิรไกรภาณุ,10800,,
ราลินนันท์,วรบูรณ์วิชัย,10800,,
มินันดา,นภเรือนธีรา,10800,,
พาธีดา,ชยกานต์กิจ,10800,,
สารัตนันท์,กฤสิทธิ์กิตติ,10800,,
วีมินทร์,สิรไกรพงศ์,10800,,
วีภัคพร,ศรไกรกิตติ,10800,,
ราสินสิทธิ์,สิรวัฒน์อนันต์,10800,,
ศิรินสิทธิ์,ภรโชติธีรา,10800,,
ราวินรักษ์,ภรเมธามงคล,10800,,
พาธินพร,รชบูรณ์กิจ,10800,,
ศินันกุล,กฤโชติภาณุ,10800,,
ทาสินเทพ,วรไกรศิริ,10800,,
รารินสิทธิ์,ภรเรือนอนันต์,10800,,
ลามินสิทธิ์,ภรเรือนกิจ,10800,,
ศิรินรักษ์,ภรเดชศิริ,10800,,
พาลินทร์,ภรเรือนอรุณ,10800,,
ทาธินสิทธิ์,วรเดชวิชัย,10800,,
สาธินนันท์,รชวัฒน์กิตติ,10800,,
ศิภัคเทพ,รชเรือนอรุณ,10800,,
วีรัตทร์,ภรไกรมงคล,10800,,
ลาสินภา,ภรไกรอรุณ,10800,,
รารินทร์,นภโชติพงศ์,10800,,
ลาภัคชัย,วรเดชธีรา,10800,,
มิธินกุล,กฤเดชภาณุ,10800,,
พานันสิทธิ์,สิรวัฒน์ศิริ,10800,,
วีวินทร์,ธรเรือนภาณุ,10800,,
ทารินรักษ์,รชภัทรกิตติ,10800,,
ลารัตดา,ธรเมธาอรุณ,10800,,
วีสินสิทธิ์,ภรเรือนศิริ,10900,,
สาธีเทพ,พลสิทธิ์ภาณุ,10900,,
ลามินชัย,ธรไกรอนันต์,10900,,
ทาธีพร,วรไกรพงศ์,10900,,
ราสินเทพ,ธรเรือนศิริ,10900,,
วีมินเทพ,ธรเรือนศิริ,10900,,
สาธินพร,ธรเดชศิริ,10900,,
ทาธินกุล,ศรภัทรกิจ,10900,,
กินันชัย,นภสิทธิ์ศิริ,10900,,
ลาสินทร์,ศรสิทธิ์พงศ์,10900,,
รารัตดา,ชยบูรณ์กิตติ,10900,,
พาลินเทพ,กฤไกรวิชัย,10900,,
วีธินภา,ธรเรือนวิชัย,10900,,
ลาลินทร์,ศรโชติกิจ,10900,,
สาธีพร,ศรโชติพงศ์,10900,,
พารินชัย,ภรภัทรภาณุ,10900,,
นานันนันท์,นภกานต์ศิริ,10900,,
มิภัคทร์,ธรกานต์ธีรา,10900,,
นาสินพร,ศรภัทรภาณุ,10900,,
มิรัตดา,กฤเรือนศิริ,10900,,
พาสินภา,ศรบูรณ์กิตติ,10900,,
สาลินชัย,ภรวัฒน์กิตติ,10900,,
นาธินสิทธิ์,ศรเมธาอรุณ,10900,,
ลารัตสิทธิ์,พลเมธามงคล,10900,,
ทาสินรักษ์,พลวัฒน์ธีรา,10900,,
วีมินดา,ธรเรือนกิตติ,10900,,
นารินพร,ธรไกรมงคล,10900,,
สาธีสิทธิ์,พลบูรณ์อนันต์,10900,,
นาวินชัย,นภกานต์ธีรา,10900,,
ทารัตเทพ,กฤเรือนกิจ,10900,,
ราธีกุล,ชยไกรภาณุ,10900,,
มิรินภา,รชสิทธิ์อรุณ,10900,,
รานันนันท์,ชยกานต์ภาณุ,10900,,
พารินสิทธิ์,รชภัทรธีรา,10900,,
มินันรักษ์,ชยกานต์ภาณุ,11000,,
ลานันสิทธิ์,กฤโชติพงศ์,11000,,
พาสินชัย,รชวัฒน์อนันต์,11000,,
ทารินสิทธิ์,สิรภัทรอนันต์,11000,,
ลานันนันท์,นภสิทธิ์ศิริ,11000,,
ลานันรักษ์,ศรไกรพงศ์,11000,,
กิลินเทพ,ธรโชติพงศ์,11000,,
สาภัคพร,นภกานต์กิจ,11000,,
ทานันชัย,รชเมธาวิชัย,11000,,
ทาสินรักษ์,พลภัทรกิจ,11000,,
วีนันภา,ศรเดชธีรา,11000,,
นาลินนันท์,ชยกานต์ภาณุ,11000,,
นามินสิทธิ์,นภโชติมงคล,11000,,
ลานันชัย,ชยสิทธิ์วิชัย,11000,,
ศินันนันท์,ภรภัทรธีรา,11000,,
วีรินชัย,ภรภัทรวิชัย,11150,,
กิรัตเทพ,ภรสิทธิ์กิตติ,11150,,
นารัตภา,รชเดชอรุณ,11150,,
ศิรินเทพ,กฤเดชอนันต์,11150,,
ราธินพร,วรโชติอรุณ,11150,,
สาธินพร,ชยบูรณ์ธีรา,11150,,
ทาธีทร์,ชยสิทธิ์มงคล,11150,,
พารัตเทพ,นภกานต์อรุณ,11150,,
รามินรักษ์,นภภัทรกิจ,11150,,
รามินเทพ,ชยบูรณ์อนันต์,11150,,
ลาสินพร,สิรเมธาอรุณ,11150,,
ศินันสิทธิ์,ชยเมธามงคล,11150,,
พารัตพร,ศรโชติภาณุ,11150,,
นารินดา,สิรเมธากิตติ,11150,,
ทารัตสิทธิ์,พลเมธาศิริ,11150,,
สาธีกุล,วรเดชศิริ,11150,,
พารินพร,ธรภัทรอรุณ,11150,,
กิธินทร์,รชวัฒน์มงคล,11150,,
พามินนันท์,ธรวัฒน์ธีรา,11150,,
นาธีดา,ชยภัทรกิจ,11150,,
ลาวินกุล,วรโชติวิชัย,11150,,
สามินนันท์,ชยสิทธิ์พงศ์,11150,,
พาธีรักษ์,ธรเมธาศิริ,11150,,
ศิธินกุล,ภรบูรณ์ภาณุ,11150,,
พาสินรักษ์,กฤวัฒน์ธีรา,11150,,
สาธินพร,ภรสิทธิ์ศิริ,11150,,
กิสินกุล,ศรวัฒน์พงศ์,11150,,
สานันกุล,ศรเมธาศิริ,11150,,
พาภัคชัย,ธรภัทรมงคล,11150,,
รารัตภา,วรบูรณ์พงศ์,11150,,
กิมินกุล,ศรสิทธิ์ธีรา,12000,,
ราสินดา,นภเดชวิชัย,12000,,
ศิรัตทร์,ธรไกรกิตติ,12000,,
พาธินเทพ,ธรโชติกิตติ,12000,,
วีรินพร,ศรไกรวิชัย,12000,,
วีธินภา,ชยไกรศิริ,12000,,
ราธีรักษ์,กฤกานต์กิตติ,12000,,
นาวินพร,กฤกานต์อนันต์,12000,,
สาลินทร์,สิรเดชกิจ,12000,,
มิลินกุล,ธรภัทรศิริ,12000,,
สาสินกุล,นภไกรมงคล,12000,,
นามินดา,นภโชติภาณุ,12000,,
กิธีรักษ์,พลสิทธิ์วิชัย,12000,,
ทาธินเทพ,รชไกรธีรา,12000,,
ลาธินเทพ,นภบูรณ์ธีรา,12000,,
รารินชัย,ธรเดชศิริ,12000,,
ลาสินสิทธิ์,ศรไกรอรุณ,12000,,
กิรัตทร์,ธรไกรอรุณ,12000,,
ศิธินทร์,กฤไกรภาณุ,12000,,
ทาธีชัย,พลโชติภาณุ,12000,,
ศิวินพร,นภสิทธิ์อนันต์,12000,,
สารินเทพ,ภรบูรณ์ศิริ,12000,,
วีธินสิทธิ์,วรเมธากิตติ,12000,,
ศิรินพร,ภรสิทธิ์ภาณุ,12000,,
ทารัตเทพ,กฤวัฒน์กิจ,12000,,
ศิรัตทร์,พลวัฒน์อนันต์,12000,,
ศินันรักษ์,พลสิทธิ์อรุณ,12000,,
วีธินเทพ,กฤเดชพงศ์,12000,,
วีนันทร์,ธรภัทรอนันต์,12000,,
ลานันรักษ์,ธรกานต์อรุณ,12000,,
ศิรินภา,ภรบูรณ์อรุณ,12000,,
นาวินพร,นภไกรอนันต์,12000,,
วีรัตนันท์,พลไกรอรุณ,12000,,
มินันสิทธิ์,พลสิทธิ์ภาณุ,12000,,
สาภัคภา,ธรบูรณ์กิตติ,12110,,
วีภัคสิทธิ์,กฤวัฒน์มงคล,12110,,
ราธินเทพ,วรไกรมงคล,12110,,
ลารัตชัย,สิรภัทรศิริ,12110,,
พาภัคภา,ชยสิทธิ์กิตติ,12110,,
นาธีพร,วรกานต์วิชัย,12110,,
รามินชัย,พลกานต์อนันต์,12110,,
พาสินภา,รชโชติกิจ,12110,,
นาวินนันท์,วรโชติภาณุ,12110,,
ลาสินภา,กฤกานต์อนันต์,12110,,
กิรินทร์,นภบูรณ์วิชัย,12110,,
ศิธินพร,ศรไกรอนันต์,12110,,
ทารินดา,ชยภัทรพงศ์,12110,,
ลาธีดา,วรโชติกิจ,12110,,
ลาลินสิทธิ์,ชยเดชภาณุ,12110,,
พานันสิทธิ์,สิรเมธากิตติ,12110,,
นาธินเทพ,ศรภัทรศิริ,12110,,
ทารัตกุล,พลวัฒน์วิชัย,12110,,
วีมินชัย,ชยเมธาภาณุ,12110,,
สาภัคกุล,วรวัฒน์ศิริ,12110,,
รารินดา,นภเมธาพงศ์,12110,,
ทาลินพร,กฤสิทธิ์กิตติ,12110,,
มิรินเทพ,วรสิทธิ์มงคล,12110,,
มิภัคนันท์,กฤกานต์ภาณุ,12110,,
รานันดา,วรไกรพงศ์,12110,,
รารัตชัย,วรเรือนธีรา,12110,,
มิมินชัย,สิรบูรณ์อรุณ,12110,,
พาวินกุล,วรกานต์พงศ์,12110,,
มิสินกุล,นภโชติภาณุ,12110,,
สาภัคสิทธิ์,รชสิทธิ์ศิริ,12110,,
กิธีนันท์,รชเมธากิจ,12110,,
มิวินพร,ภรบูรณ์พงศ์,12110,,
ลาภัคสิทธิ์,กฤเดชอรุณ,12110,,
มิรัตสิทธิ์,รชกานต์กิตติ,12110,,
ราวินดา,พลกานต์อรุณ,12120,,
รารัตเทพ,ศรเดชอรุณ,12120,,
มิภัคนันท์,รชสิทธิ์ศิริ,12120,,
ศิลินสิทธิ์,รชเรือนธีรา,12120,,
พาภัคนันท์,รชสิทธิ์วิชัย,12120,,
นารัตทร์,รชวัฒน์ภาณุ,12120,,
ทาลินพร,ภรเมธาอนันต์,12120,,
มิรัตดา,ศรเดชภาณุ,12120,,
วีธีสิทธิ์,ชยบูรณ์มงคล,12120,,
สาลินชัย,นภเรือนพงศ์,12120,,
วีวินรักษ์,ภรเดชพงศ์,12120,,
สารัตทร์,วรเดชมงคล,12120,,
ทารินชัย,สิรบูรณ์มงคล,12120,,
กิธินเทพ,พลเรือนอนันต์,12120,,
ลาสินนันท์,พลไกรภาณุ,12120,,
รามินพร,กฤไกรอรุณ,12120,,
พาธีพร,นภเดชกิตติ,12120,,
นารัตสิทธิ์,กฤโชติพงศ์,12120,,
พาสินเทพ,นภวัฒน์อนันต์,12120,,
มิธินชัย,พลสิทธิ์ภาณุ,12120,,
ทามินรักษ์,ศรเรือนอรุณ,12120,,
ราวินสิทธิ์,รชเดชภาณุ,12120,,
พาลินดา,สิรโชติพงศ์,12120,,
มิวินนันท์,ภรโชติกิจ,12120,,
พามินกุล,ชยภัทรอรุณ,12120,,
ลาสินชัย,ธรเรือนศิริ,12120,,
กิรินภา,สิรวัฒน์พงศ์,12120,,
ราธีนันท์,สิรเดชอรุณ,12120,,
รารินพร,กฤสิทธิ์ศิริ,12120,,
สาธินชัย,ภรโชติอรุณ,12120,,
รารินรักษ์,ภรเดชธีรา,12120,,
ศิรินนันท์,ธรบูรณ์มงคล,12120,,
ศิรินชัย,ศรภัทรอรุณ,12120,,
พาภัคดา,วรบูรณ์ธีรา,12120,,
วีสินนันท์,รชกานต์ศิริ,12130,,
วีสินภา,วรเมธากิจ,12130,,
ลาลินกุล,ธรวัฒน์กิจ,12130,,
ลาสินภา,ชยไกรกิตติ,12130,,
ทาธีดา,รชเดชมงคล,12130,,
ราลินเทพ,ชยบูรณ์ศิริ,12130,,
สานันภา,ธรกานต์อนันต์,12130,,
พาภัคชัย,ชยบูรณ์วิชัย,12130,,
ทาลินพร,ชยภัทรวิชัย,12130,,
ทามินรักษ์,รชสิทธิ์ธีรา,12130,,
ลารัตพร,รชภัทรอรุณ,12130,,
นานันนันท์,สิรกานต์อรุณ,12130,,
พาสินรักษ์,ชยเรือนอรุณ,12130,,
มิลินภา,พลวัฒน์กิจ,12130,,
ลามินนันท์,ภรโชติมงคล,12130,,
พาภัคทร์,สิรภัทรอนันต์,12130,,
วีรัตรักษ์,พลไกรพงศ์,12130,,
วีสินรักษ์,ธรเรือนอนันต์,12130,,
มิธินภา,ภรไกรศิริ,12130,,
กิธีพร,ธรบูรณ์กิตติ,12130,,
พาวินพร,นภสิทธิ์มงคล,12130,,
พารินทร์,ชยภัทรกิจ,12130,,
พารินทร์,สิรโชติมงคล,12130,,
สานันพร,ธรวัฒน์ธีรา,12130,,
กิธินกุล,วรเดชอรุณ,12130,,
ทามินรักษ์,ศรโชติธีรา,12130,,
ราธีทร์,ธรวัฒน์อรุณ,12130,,
กิธินรักษ์,ภรภัทรมงคล,12130,,
กิภัคเทพ,ชยกานต์วิชัย,12130,,
วีสินดา,ภรโชติภาณุ,12130,,
สาภัคทร์,พลวัฒน์ศิริ,12130,,
กิรินรักษ์,สิรเดชภาณุ,12130,,
ลารัตกุล,ธรโชติอนันต์,12130,,
นารินเทพ,ศรเมธากิตติ,12130,,
กิธีนันท์,วรวัฒน์กิจ,12140,,
พาภัคสิทธิ์,ชยสิทธิ์มงคล,12140,,
นาสินนันท์,รชบูรณ์ภาณุ,12140,,
กิธีพร,วรภัทรกิตติ,12140,,
กิธินเทพ,กฤภัทรมงคล,12140,,
นาสินนันท์,ชยกานต์อนันต์,12140,,
ลารัตสิทธิ์,วรวัฒน์กิจ,12140,,
ศิวินทร์,กฤเดชศิริ,12140,,
นาวินนันท์,วรเดชภาณุ,12140,,
มิธีนันท์,นภบูรณ์ศิริ,12140,,
กิลินรักษ์,ชยเรือนวิชัย,12140,,
ศิวินเทพ,ชยเมธากิจ,12140,,
สาวินดา,วรสิทธิ์พงศ์,12140,,
พารินดา,ศรภัทรธีรา,12140,,
วีธินดา,พลบูรณ์อรุณ,12140,,
ลาสินภา,นภบูรณ์ศิริ,12140,,
พาภัคชัย,รชภัทรอรุณ,12140,,
วีรัตนันท์,วรสิทธิ์ภาณุ,12140,,
พาธินเทพ,พลไกรวิชัย,12140,,
กิธีสิทธิ์,ชยไกรมงคล,12140,,
พารินภา,กฤเมธาธีรา,12140,,
รารัตนันท์,รชสิทธิ์วิชัย,12140,,
นาลินรักษ์,ชยกานต์ธีรา,12140,,
กิลินกุล,สิรเดชอนันต์,12140,,
นาสินนันท์,พลโชติศิริ,12140,,
กินันทร์,กฤเมธาพงศ์,12140,,
ลารัตกุล,ภรสิทธิ์กิตติ,12140,,
ลาสินรักษ์,สิรวัฒน์กิจ,12140,,
พาสินทร์,วรเรือนภาณุ,12140,,
วีรัตชัย,นภบูรณ์ธีรา,12140,,
ทารัตสิทธิ์,พลเดชศิริ,12140,,
รารินกุล,นภวัฒน์กิจ,12140,,
สาลินเทพ,รชเรือนกิจ,12140,,
สามินดา,วรบูรณ์ธีรา,12140,,
รานันดา,สิรบูรณ์กิตติ,12150,,
สารินดา,พลเดชอรุณ,12150,,
พาธินทร์,ชยเรือนศิริ,12150,,
กิลินกุล,ธรบูรณ์กิตติ,12150,,
ลาธินดา,นภไกรมงคล,12150,,
วีสินนันท์,ชยเดชกิตติ,12150,,
ทารินภา,นภเมธาธีรา,12150,,
กินันทร์,นภเมธากิตติ,12150,,
สารินรักษ์,พลไกรวิชัย,12150,,
ราสินทร์,ภรโชติกิตติ,12150,,
มิธีชัย,ภรเรือนภาณุ,12150,,
สารัตทร์,พลเดชธีรา,12150,,
กิธีนันท์,สิรภัทรธีรา,12150,,
รามินกุล,ศรไกรภาณุ,12150,,
พารินกุล,วรสิทธิ์อนันต์,12150,,
รานันชัย,รชภัทรวิชัย,12150,,
นาสินพร,ภรกานต์ภาณุ,12150,,
มิลินชัย,รชบูรณ์มงคล,12150,,
มิมินกุล,ศรวัฒน์อรุณ,12150,,
พารัตพร,ธรเรือนศิริ,12150,,
ลาภัคเทพ,กฤไกรอรุณ,12150,,
มิสินกุล,ชยโชติกิตติ,12150,,
กิลินนันท์,รชสิทธิ์กิตติ,12150,,
นารินภา,ธรวัฒน์มงคล,12150,,
วีธินพร,ธรภัทรกิตติ,12150,,
ลารัตรักษ์,นภบูรณ์มงคล,12150,,
นาภัคเทพ,กฤวัฒน์ภาณุ,12150,,
พามินดา,วรเรือนศิริ,12150,,
สาภัคกุล,สิรสิทธิ์อนันต์,12150,,
พาธินรักษ์,สิรไกรอรุณ,12150,,
ลาวินดา,ธรกานต์ภาณุ,12150,,
มิวินเทพ,วรโชติวิชัย,12150,,
พาสินภา,พลภัทรภาณุ,12150,,
นาธินรักษ์,นภเรือนศิริ,12150,,
วีรินพร,ภรเดชอรุณ,12160,,
สารินดา,นภภัทรกิตติ,12160,,
พานันกุล,ชยวัฒน์กิตติ,12160,,
ลาภัคดา,กฤภัทรธีรา,12160,,
มิลินชัย,ชยโชติมงคล,12160,,
กิลินทร์,ภรวัฒน์พงศ์,12160,,
พารัตชัย,ธรกานต์กิจ,12160,,
วีรินชัย,กฤเมธามงคล,12160,,
รารินนันท์,รชเดชศิริ,12160,,
ทาธีทร์,ภรไกรพงศ์,12160,,
พาวินเทพ,สิรวัฒน์มงคล,12160,,
กิมินเทพ,สิรไกรธีรา,12160,,
