FirstName,LastName,PostalCode,TrackingNo,Address
กิธีเทพ,สิรเมธากิตติ,12160,,
มิธีทร์,ศรเรือนศิริ,12160,,
ลามินนันท์,ศรไกรอนันต์,12160,,
สารินเทพ,ชยกานต์มงคล,12160,,
กินันสิทธิ์,พลเดชกิตติ,12160,,
วีรัตชัย,วรโชติวิชัย,12160,,
นาธีพร,ชยวัฒน์มงคล,12160,,
วีธินดา,กฤเรือนวิชัย,12160,,
วีภัคชัย,ชยเรือนมงคล,12160,,
ทาลินทร์,วรบูรณ์ภาณุ,12160,,
มินันภา,วรไกรอนันต์,12160,,
วีภัคพร,สิรเรือนกิจ,12160,,
ลาสินเทพ,ชยไกรศิริ,12160,,
ลารัตชัย,ภรภัทรกิตติ,12160,,
ศิธินพร,วรภัทรภาณุ,12160,,
นาสินกุล,ศรเดชมงคล,12160,,
ศิรัตชัย,ภรโชติศิริ,12160,,
วีธีเทพ,ภรเรือนภาณุ,12160,,
มิสินทร์,วรวัฒน์พงศ์,12160,,
วีธีนันท์,พลกานต์อรุณ,12160,,
นาธินทร์,ภรสิทธิ์ภาณุ,12160,,
สานันทร์,พลเรือนมงคล,12160,,
นาธินพร,สิรเมธาภาณุ,12170,,
ราธีนันท์,สิรภัทรศิริ,12170,,
ราสินนันท์,นภเดชวิชัย,12170,,
พามินทร์,พลโชติพงศ์,12170,,
ศินันทร์,วรเรือนอนันต์,12170,,
ราวินรักษ์,พลไกรอรุณ,12170,,
นาวินรักษ์,สิรเมธาภาณุ,12170,,
นาลินทร์,สิรภัทรกิจ,12170,,
ศิวินทร์,พลวัฒน์ภาณุ,12170,,
ลาธีภา,สิรวัฒน์ภาณุ,12170,,
ศินันพร,พลสิทธิ์อรุณ,12170,,
ราวินภา,ธรสิทธิ์มงคล,12170,,
ลาวินทร์,สิรเมธาวิชัย,12170,,
ทาธีเทพ,ภรกานต์ธีรา,12170,,
สานันเทพ,สิรวัฒน์ภาณุ,12170,,
วีธีสิทธิ์,ชยสิทธิ์อนันต์,12170,,
มิรินภา,วรโชติภาณุ,12170,,
สาธินชัย,ภรไกรกิจ,12170,,
มิธินรักษ์,วรโชติอนันต์,12170,,
พาวินทร์,ศรสิทธิ์อนันต์,12170,,
ลาสินสิทธิ์,ศรไกรอนันต์,12170,,
พาธีชัย,วรวัฒน์ธีรา,12170,,
สานันดา,ภรกานต์กิจ,12170,,
ศิรินชัย,พลเดชธีรา,12170,,
สารัตเทพ,วรเมธาศิริ,12170,,
สาลินดา,ธรภัทรภาณุ,12170,,
นาธินกุล,ธรไกรกิตติ,12170,,
ทาวินกุล,รชวัฒน์อนันต์,12170,,
กิลินนันท์,ภรเรือนมงคล,12170,,
พาภัคภา,ภรโชติศิริ,12170,,
ราธินเทพ,สิรไกรกิตติ,12170,,
ทาธีทร์,พลบูรณ์กิจ,12170,,
สาธีชัย,ธรไกรกิจ,12170,,
ศิธินรักษ์,ศรเมธากิตติ,12170,,
มิลินภา,วรสิทธิ์ศิริ,13160,,
นานันนันท์,พลสิทธิ์มงคล,13160,,
ทาวินดา,ภรสิทธิ์กิจ,13160,,
ศิภัคกุล,สิรภัทรศิริ,13160,,
พาวินนันท์,ชยเมธาธีรา,13160,,
ศินันนันท์,วรบูรณ์วิชัย,13160,,
สาธีกุล,พลเดชธีรา,13160,,
นาธินดา,ศรไกรอรุณ,13160,,
มิภัคเทพ,พลเดชพงศ์,13160,,
ลาภัคดา,รชสิทธิ์อนันต์,13160,,
กิภัครักษ์,ชยภัทรอรุณ,13160,,
ทาธินทร์,ภรวัฒน์ธีรา,13160,,
ทาธินกุล,ภรวัฒน์กิตติ,13160,,
รารัตกุล,สิรไกรอนันต์,13160,,
นาธินดา,ภรสิทธิ์ภาณุ,13160,,
นาธีเทพ,นภกานต์กิจ,13160,,
กิลินภา,พลเมธาอรุณ,13160,,
มินันรักษ์,ภรเมธากิตติ,13160,,
รานันกุล,ธรภัทรกิตติ,13160,,
พาธินทร์,พลภัทรวิชัย,13160,,
วีนันนันท์,วรกานต์ศิริ,13160,,
รามินรักษ์,พลบูรณ์วิชัย,13160,,
กิธีเทพ,กฤเมธาพงศ์,13160,,
มิภัคพร,กฤภัทรอรุณ,13160,,
ลาสินทร์,ชยโชติกิจ,13160,,
นารัตชัย,วรกานต์กิตติ,13160,,
มิธีเทพ,พลเรือนอนันต์,13160,,
พาธีชัย,ศรเรือนกิตติ,13160,,
นามินภา,พลกานต์พงศ์,13160,,
สารินชัย,วรไกรภาณุ,13160,,
ราธินชัย,สิรบูรณ์ศิริ,13160,,
กินันกุล,กฤโชติอรุณ,13160,,
ทาธินทร์,ศรเรือนมงคล,13160,,
พานันชัย,พลภัทรภาณุ,13170,,
ราธินทร์,ธรกานต์ภาณุ,13170,,
ทามินนันท์,ศรสิทธิ์อรุณ,13170,,
นารัตภา,กฤภัทรอรุณ,13170,,
ศิมินพร,วรเดชศิริ,13170,,
วีวินทร์,ศรเมธากิตติ,13170,,
ราธินชัย,สิรไกรอนันต์,13170,,
ศิสินสิทธิ์,นภวัฒน์กิตติ,13170,,
มิลินทร์,สิรไกรภาณุ,13170,,
รารินรักษ์,กฤบูรณ์วิชัย,13170,,
ลาลินดา,ศรเมธาภาณุ,13170,,
วีสินชัย,รชกานต์ศิริ,13170,,
มิภัคทร์,ธรเดชมงคล,13170,,
มิสินรักษ์,ภรสิทธิ์ภาณุ,13170,,
ศิภัครักษ์,พลโชติกิตติ,13170,,
ราวินทร์,ภรสิทธิ์มงคล,13170,,
วีลินกุล,ภรเมธากิจ,13170,,
นารินรักษ์,นภเดชธีรา,13170,,
ราวินกุล,สิรกานต์ธีรา,13170,,
ลาธินภา,ชยไกรมงคล,13170,,
ศิวินพร,ภรไกรมงคล,13170,,
นามินนันท์,ภรวัฒน์ศิริ,13170,,
ศิธีดา,กฤกานต์ธีรา,13170,,
สารัตกุล,ภรโชติศิริ,13170,,
กิวินชัย,สิรบูรณ์กิจ,13170,,
ทาสินพร,กฤบูรณ์มงคล,13170,,
พาลินเทพ,พลไกรอรุณ,13170,,
ทารินพร,พลสิทธิ์ภาณุ,13170,,
ทาลินเทพ,นภเรือนอรุณ,13170,,
ทาลินดา,นภเรือนพงศ์,13170,,
สารัตนันท์,พลสิทธิ์ศิริ,13170,,
รารัตดา,กฤสิทธิ์อนันต์,13170,,
สาธินกุล,รชไกรศิริ,13170,,
ทานันภา,นภภัทรศิริ,13180,,
กิรินชัย,สิรเรือนกิตติ,13180,,
ราธีรักษ์,ศรสิทธิ์ศิริ,13180,,
ทาธีชัย,กฤไกรศิริ,13180,,
นาภัคกุล,กฤบูรณ์มงคล,13180,,
ลานันภา,รชเมธากิจ,13180,,
วีธินเทพ,นภเมธาอรุณ,13180,,
มิธีชัย,ธรเรือนอนันต์,13180,,
ราลินนันท์,ศรเมธาอรุณ,13180,,
พาภัคทร์,สิรเมธากิจ,13180,,
ทาภัคดา,พลกานต์ภาณุ,13180,,
รารินทร์,นภกานต์ภาณุ,13180,,
มิภัคเทพ,ธรภัทรวิชัย,13180,,
สาธีกุล,กฤวัฒน์ศิริ,13180,,
วีลินสิทธิ์,ภรไกรกิตติ,13180,,
ศิธินภา,กฤโชติศิริ,13180,,
วีธินกุล,วรโชติมงคล,13180,,
นาภัคภา,ชยภัทรพงศ์,13180,,
สารัตดา,รชสิทธิ์ธีรา,13180,,
นารินทร์,ธรเดชกิตติ,13180,,
ทารัตภา,นภวัฒน์ธีรา,13180,,
ศิวินรักษ์,ภรภัทรศิริ,13180,,
ราวินดา,ชยกานต์ธีรา,13180,,
ทาภัคสิทธิ์,กฤกานต์ภาณุ,13180,,
รารัตนันท์,สิรสิทธิ์กิจ,13180,,
นาภัคนันท์,รชภัทรมงคล,13180,,
นารินสิทธิ์,รชบูรณ์อรุณ,13180,,
รามินเทพ,กฤวัฒน์ธีรา,13180,,
ศิมินภา,วรเรือนธีรา,13180,,
กินันดา,รชไกรธีรา,13180,,
นาลินทร์,พลเดชมงคล,13180,,
สาลินภา,รชสิทธิ์ศิริ,13180,,
กิมินเทพ,พลเดชพงศ์,13180,,
ศิธีดา,ธรกานต์มงคล,14000,,
รารัตดา,ศรสิทธิ์ศิริ,14000,,
ทาธินเทพ,ศรบูรณ์กิตติ,14000,,
ราวินดา,ศรเมธาศิริ,14000,,
ศิลินเทพ,ธรเรือนพงศ์,14000,,
นามินกุล,นภบูรณ์ภาณุ,14000,,
มิภัคทร์,วรไกรภาณุ,14000,,
นามินภา,นภสิทธิ์ภาณุ,14000,,
วีมินกุล,สิรสิทธิ์ภาณุ,14000,,
นามินดา,พลโชติภาณุ,14000,,
มิวินชัย,รชโชติภาณุ,14000,,
มิวินนันท์,รชเมธาพงศ์,14000,,
ราธินรักษ์,ธรไกรวิชัย,14000,,
ศิลินทร์,ศรวัฒน์มงคล,14000,,
ลาภัคพร,วรโชติมงคล,14000,,
ลารินสิทธิ์,พลวัฒน์กิตติ,14000,,
ราวินเทพ,ธรเมธาวิชัย,14000,,
ลาสินทร์,กฤบูรณ์อรุณ,14000,,
นามินรักษ์,สิรภัทรวิชัย,14000,,
ทามินภา,ชยเมธาอนันต์,14000,,
สาลินสิทธิ์,นภเดชธีรา,14000,,
วีนันรักษ์,ภรกานต์อนันต์,14000,,
กิภัคกุล,ศรสิทธิ์ธีรา,14000,,
วีมินสิทธิ์,กฤเมธาอนันต์,14000,,
ศิรัตรักษ์,ภรเรือนกิจ,14000,,
ทารินรักษ์,ชยไกรพงศ์,14000,,
วีนันเทพ,ธรเดชอนันต์,14000,,
สาวินรักษ์,รชโชติพงศ์,14000,,
นานันภา,ศรโชติธีรา,14000,,
ศิสินนันท์,สิรภัทรมงคล,14000,,
กิธีดา,พลเดชศิริ,14000,,
พารินกุล,รชโชติศิริ,14000,,
นาวินสิทธิ์,กฤวัฒน์ศิริ,14000,,
พารินชัย,ธรเรือนศิริ,14000,,
วีสินทร์,พลกานต์ภาณุ,15110,,
วีภัคชัย,ภรเมธาศิริ,15110,,
สารัตกุล,สิรไกรวิชัย,15110,,
กิธีพร,นภเมธากิจ,15110,,
ราวินกุล,วรวัฒน์กิตติ,15110,,
ทารัตพร,รชเดชอนันต์,15110,,
มิธินกุล,ภรวัฒน์ภาณุ,15110,,
นาภัคภา,วรสิทธิ์อนันต์,15110,,
ราภัคภา,พลโชติธีรา,15110,,
ราภัครักษ์,กฤกานต์พงศ์,15110,,
ราวินกุล,สิรบูรณ์มงคล,15110,,
ทาภัคเทพ,ธรไกรศิริ,15110,,
พาธีภา,รชโชติภาณุ,15110,,
พาภัคชัย,ชยภัทรศิริ,15110,,
ราสินกุล,นภเดชพงศ์,15110,,
วีลินสิทธิ์,วรวัฒน์ศิริ,15110,,
ทาวินชัย,ชยสิทธิ์อนันต์,15110,,
วีรัตชัย,นภโชติกิจ,15110,,
พามินรักษ์,ภรภัทรพงศ์,15110,,
กิรินสิทธิ์,กฤวัฒน์กิจ,15110,,
มิลินเทพ,ธรเดชธีรา,15110,,
สารัตภา,นภไกรวิชัย,15110,,
รานันรักษ์,ศรกานต์ภาณุ,15110,,
รามินพร,กฤเดชศิริ,15110,,
ลารัตดา,ชยโชติมงคล,15110,,
วีนันดา,สิรภัทรกิตติ,15110,,
พาภัคชัย,กฤวัฒน์กิจ,15110,,
กินันทร์,พลเดชภาณุ,15110,,
ราสินเทพ,วรวัฒน์ศิริ,15110,,
ราวินทร์,กฤไกรธีรา,15110,,
พาลินสิทธิ์,สิรเมธาภาณุ,15110,,
ทาลินดา,ภรสิทธิ์อรุณ,15110,,
ศิรัตกุล,พลเดชศิริ,15110,,
กิธีเทพ,สิรกานต์อนันต์,15110,,
วีนันเทพ,นภเรือนกิจ,16000,,
สานันนันท์,ภรเรือนวิชัย,16000,,
ลาวินสิทธิ์,พลเมธาอรุณ,16000,,
กิมินกุล,กฤภัทรมงคล,16000,,
กิมินเทพ,รชบูรณ์วิชัย,16000,,
สาวินสิทธิ์,วรภัทรกิตติ,16000,,
ศิภัคนันท์,กฤเรือนพงศ์,16000,,
มิธีรักษ์,สิรบูรณ์กิตติ,16000,,
ลานันกุล,ภรวัฒน์ธีรา,16000,,
ราสินนันท์,รชบูรณ์อรุณ,16000,,
ทานันดา,ธรโชติกิตติ,16000,,
ลาสินดา,สิรกานต์พงศ์,16000,,
ลาวินกุล,ธรวัฒน์วิชัย,16000,,
พาสินรักษ์,นภกานต์วิชัย,16000,,
สาสินดา,ชยกานต์ศิริ,16000,,
กิธีสิทธิ์,ธรบูรณ์วิชัย,16000,,
สาวินทร์,ศรกานต์อนันต์,16000,,
กิลินรักษ์,กฤเดชธีรา,16000,,
สาสินสิทธิ์,นภภัทรกิจ,16000,,
กิธีเทพ,ศรสิทธิ์ภาณุ,16000,,
พาสินรักษ์,ศรเรือนกิจ,16000,,
กิธินชัย,ธรไกรพงศ์,16000,,
กิวินสิทธิ์,นภภัทรภาณุ,16000,,
มิสินพร,ชยภัทรพงศ์,16000,,
สารัตภา,นภวัฒน์พงศ์,16000,,
วีภัคนันท์,วรวัฒน์ธีรา,16000,,
ทานันกุล,ธรโชติกิจ,16000,,
ศิธินกุล,ชยเรือนพงศ์,16000,,
วีมินพร,ภรโชติอนันต์,16000,,
ศิธินภา,ชยโชติกิตติ,16000,,
พาสินนันท์,ศรเมธาพงศ์,16000,,
ศิธินเทพ,พลเมธาอนันต์,16000,,
สาวินชัย,นภเมธาศิริ,16000,,
นารินกุล,รชไกรมงคล,16000,,
มิธีชัย,นภเดชธีรา,16110,,
ราธีนันท์,วรโชติวิชัย,16110,,
รารัตรักษ์,นภเรือนศิริ,16110,,
วีวินภา,กฤเมธาวิชัย,16110,,
พานันรักษ์,ธรวัฒน์กิจ,16110,,
ทามินชัย,ภรไกรธีรา,16110,,
สานันเทพ,กฤบูรณ์กิจ,16110,,
นามินรักษ์,วรไกรอนันต์,16110,,
กิภัคชัย,ภรโชติธีรา,16110,,
กิธีรักษ์,กฤโชติวิชัย,16110,,
ศิวินดา,ศรเรือนอรุณ,16110,,
สาธินสิทธิ์,ภรสิทธิ์กิตติ,16110,,
สามินดา,กฤบูรณ์มงคล,16110,,
พาภัคเทพ,ศรกานต์วิชัย,16110,,
พารินพร,ภรเมธาภาณุ,16110,,
ทาวินรักษ์,วรเดชศิริ,16110,,
วีวินเทพ,ศรไกรธีรา,16110,,
มิวินรักษ์,นภเดชกิตติ,16110,,
รารินสิทธิ์,รชโชติกิตติ,16110,,
มิสินชัย,กฤวัฒน์กิตติ,16110,,
รารินพร,สิรไกรภาณุ,16110,,
ทาภัคพร,รชกานต์วิชัย,16110,,
วีรินภา,ภรบูรณ์มงคล,16110,,
รารัตรักษ์,ศรโชติพงศ์,16110,,
รารัตเทพ,รชโชติภาณุ,16110,,
ศิภัคชัย,สิรเรือนพงศ์,16110,,
กิรินชัย,ศรไกรมงคล,16110,,
นาธีทร์,ศรเดชอนันต์,16110,,
พาธีเทพ,วรเดชศิริ,16110,,
ลาสินทร์,นภโชติวิชัย,16110,,
สาภัคชัย,นภภัทรกิตติ,16110,,
กิรินภา,ธรเดชศิริ,16110,,
ทาสินกุล,พลเมธาภาณุ,16110,,
สารัตกุล,นภวัฒน์ภาณุ,16110,,
ทาธีสิทธิ์,นภสิทธิ์มงคล,17110,,
ทาภัคทร์,พลเมธาอรุณ,17110,,
ลาธินสิทธิ์,วรสิทธิ์ศิริ,17110,,
กิรินภา,ชยกานต์กิจ,17110,,
รารัตพร,รชโชติภาณุ,17110,,
วีธีชัย,พลโชติศิริ,17110,,
สาสินชัย,ธรโชติอรุณ,17110,,
นาวินรักษ์,นภเดชกิจ,17110,,
นามินชัย,ศรวัฒน์ภาณุ,17110,,
รานันภา,นภโชติอรุณ,17110,,
มิธินดา,วรกานต์ศิริ,17110,,
ทารัตกุล,พลไกรพงศ์,17110,,
ทามินเทพ,พลกานต์กิจ,17110,,
ศิสินสิทธิ์,ชยไกรธีรา,17110,,
ลาลินเทพ,รชบูรณ์กิตติ,17110,,
นาวินภา,ศรเดชพงศ์,17110,,
ลานันรักษ์,ศรภัทรพงศ์,17110,,
ลาธินภา,วรเรือนพงศ์,17110,,
ลาสินกุล,ศรเดชอนันต์,17110,,
ทาลินภา,กฤโชติธีรา,17110,,
ทารินทร์,นภกานต์ธีรา,17110,,
ราธินทร์,ภรภัทรอรุณ,17110,,
พานันดา,วรสิทธิ์ศิริ,17110,,
วีภัครักษ์,สิรไกรภาณุ,17110,,
ทานันรักษ์,ศรไกรมงคล,17110,,
นาลินรักษ์,สิรบูรณ์อรุณ,17110,,
ทาธินชัย,วรโชติอรุณ,17110,,
รารินภา,ชยวัฒน์อนันต์,17110,,
มิรัตนันท์,ชยเดชศิริ,17110,,
พารินพร,พลเดชอรุณ,17110,,
ราภัคพร,พลภัทรภาณุ,17110,,
ราวินกุล,ภรวัฒน์ธีรา,17110,,
สาธีภา,พลสิทธิ์กิจ,17110,,
ราวินรักษ์,ศรเดชอนันต์,17110,,
สานันรักษ์,นภเมธาอนันต์,18000,,
สารัตภา,นภเรือนมงคล,18000,,
วีรินภา,ศรวัฒน์ศิริ,18000,,
พาธีกุล,วรวัฒน์มงคล,18000,,
ทาสินดา,รชไกรมงคล,18000,,
สารินทร์,ชยไกรพงศ์,18000,,
นามินรักษ์,สิรภัทรอรุณ,18000,,
สารินพร,วรสิทธิ์อนันต์,18000,,
ทาวินพร,ภรวัฒน์ศิริ,18000,,
รานันสิทธิ์,รชบูรณ์พงศ์,18000,,
ลาวินกุล,ชยเดชธีรา,18000,,
ลารัตสิทธิ์,นภเรือนพงศ์,18000,,
ศิธีทร์,ชยวัฒน์ศิริ,18000,,
กินันสิทธิ์,นภเดชมงคล,18000,,
รารัตชัย,รชเดชศิริ,18000,,
วีมินสิทธิ์,ชยวัฒน์อนันต์,18000,,
พาธินรักษ์,ธรบูรณ์อรุณ,18000,,
มิภัคนันท์,ธรเดชธีรา,18000,,
นาภัคสิทธิ์,รชเมธาธีรา,18000,,
ลาสินนันท์,ชยกานต์กิตติ,18000,,
สามินพร,รชไกรมงคล,18000,,
พารัตนันท์,นภเมธากิตติ,18000,,
กิรัตกุล,กฤกานต์มงคล,18000,,
สาธีเทพ,ศรสิทธิ์วิชัย,18000,,
ศินันกุล,วรเมธาอนันต์,18000,,
ลาภัคพร,วรวัฒน์ธีรา,18000,,
ราวินพร,รชโชติศิริ,18000,,
ทาธินภา,ศรโชติอนันต์,18000,,
พาลินนันท์,ชยกานต์อนันต์,18000,,
กินันเทพ,วรบูรณ์พงศ์,18000,,
สาธินดา,รชภัทรภาณุ,18000,,
มิธีสิทธิ์,ธรเมธาวิชัย,18000,,
ลานันดา,นภวัฒน์ศิริ,18000,,
วีภัคชัย,ภรโชติกิตติ,18000,,
ศิสินสิทธิ์,ธรสิทธิ์มงคล,18110,,
พานันภา,สิรโชติศิริ,18110,,
ลาธินภา,พลโชติอรุณ,18110,,
ทารินทร์,กฤเดชอนันต์,18110,,
ศินันกุล,พลไกรศิริ,18110,,
พาธินทร์,นภกานต์พงศ์,18110,,
นานันเทพ,พลโชติอนันต์,18110,,
ศิธินกุล,พลกานต์ธีรา,18110,,
กิลินดา,พลไกรมงคล,18110,,
รามินเทพ,นภบูรณ์ธีรา,18110,,
พาลินชัย,กฤไกรอรุณ,18110,,
ราวินทร์,วรสิทธิ์ศิริ,18110,,
ราลินภา,นภบูรณ์ภาณุ,18110,,
สารินทร์,ชยบูรณ์กิจ,18110,,
มิสินดา,พลวัฒน์มงคล,18110,,
พามินสิทธิ์,สิรเมธาศิริ,18110,,
ศิรัตชัย,ธรไกรมงคล,18110,,
มิรินดา,สิรเดชมงคล,18110,,
ลารัตรักษ์,รชสิทธิ์ธีรา,18110,,
ทาธินกุล,วรเรือนมงคล,18110,,
สามินชัย,นภภัทรพงศ์,18110,,
กิธินนันท์,นภเดชธีรา,18110,,
นามินกุล,กฤภัทรกิจ,18110,,
