FirstName,LastName,PostalCode,TrackingNo,Address
มิรินทร์,กฤสิทธิ์อนันต์,34190,,
ลาลินดา,สิรเดชกิจ,34190,,
ทาสินกุล,วรโชติศิริ,34190,,
วีธีดา,รชสิทธิ์ศิริ,34190,,
ทานันนันท์,กฤเมธาอนันต์,34190,,
ราธีสิทธิ์,ภรวัฒน์กิตติ,34190,,
ศิธีทร์,วรเมธากิตติ,34190,,
ลาภัคนันท์,กฤบูรณ์ภาณุ,34190,,
ทารัตนันท์,กฤบูรณ์พงศ์,34190,,
มิรินนันท์,ธรสิทธิ์พงศ์,34190,,
พามินกุล,รชสิทธิ์อนันต์,34190,,
มิรินนันท์,ธรเดชพงศ์,34190,,
รานันชัย,ศรเดชกิตติ,34190,,
มิธีนันท์,ชยโชติมงคล,34190,,
ทาธินเทพ,วรวัฒน์วิชัย,34190,,
กิธินนันท์,ศรวัฒน์มงคล,34190,,
รารัตทร์,ธรกานต์ธีรา,34190,,
ลาธีรักษ์,ธรสิทธิ์อรุณ,34190,,
กิธีพร,รชภัทรมงคล,34190,,
นาวินกุล,ศรกานต์อรุณ,34190,,
ศิมินกุล,สิรไกรธีรา,34190,,
สาธินพร,สิรภัทรภาณุ,35000,,
มิมินนันท์,สิรไกรวิชัย,35000,,
ศิธีทร์,ชยไกรกิจ,35000,,
พาธีเทพ,รชเรือนกิตติ,35000,,
ลานันนันท์,รชไกรพงศ์,35000,,
ศิสินเทพ,นภภัทรกิตติ,35000,,
มินันพร,นภโชติกิตติ,35000,,
ศิวินนันท์,วรเรือนกิจ,35000,,
ศิธินรักษ์,ชยเรือนธีรา,35000,,
ศิรินภา,สิรเมธาศิริ,35000,,
ศิสินนันท์,รชกานต์มงคล,35000,,
ทาธินสิทธิ์,พลสิทธิ์พงศ์,35000,,
พามินสิทธิ์,ศรเมธากิตติ,35000,,
ทารัตรักษ์,กฤวัฒน์ธีรา,35000,,
ลามินภา,ชยวัฒน์ธีรา,35000,,
มิลินภา,นภไกรกิจ,35000,,
ราวินดา,ศรบูรณ์กิตติ,35000,,
นาสินกุล,รชกานต์ธีรา,35000,,
มินันทร์,ศรไกรกิตติ,35000,,
วีมินดา,ภรบูรณ์มงคล,35000,,
ศิวินภา,กฤเรือนพงศ์,35000,,
สารินกุล,รชโชติอนันต์,35000,,
สาวินกุล,สิรวัฒน์กิจ,35000,,
กิธินเทพ,นภกานต์อนันต์,35000,,
มิวินชัย,สิรวัฒน์ศิริ,35000,,
รานันพร,สิรเดชกิจ,35000,,
พานันกุล,ศรบูรณ์พงศ์,35000,,
พารัตเทพ,ภรไกรมงคล,35000,,
ศิรัตนันท์,ภรสิทธิ์อรุณ,35000,,
พานันภา,นภโชติอรุณ,35000,,
ทาธินทร์,พลบูรณ์อรุณ,35000,,
มิมินเทพ,ภรวัฒน์ภาณุ,35000,,
นาธินเทพ,วรสิทธิ์กิจ,35000,,
รานันดา,กฤบูรณ์อรุณ,35110,,
ศินันนันท์,นภเรือนมงคล,35110,,
ศินันนันท์,สิรโชติภาณุ,35110,,
วีสินกุล,ศรกานต์มงคล,35110,,
วีนันทร์,รชกานต์พงศ์,35110,,
มิรินกุล,พลภัทรกิตติ,35110,,
กิสินทร์,ภรเดชศิริ,35110,,
ทาสินพร,กฤกานต์มงคล,35110,,
ลานันชัย,พลกานต์กิตติ,35110,,
วีธีทร์,พลไกรอนันต์,35110,,
มิธินสิทธิ์,ภรบูรณ์มงคล,35110,,
ทาวินทร์,ธรเรือนอรุณ,35110,,
ราวินพร,วรโชติกิจ,35110,,
พาสินดา,กฤไกรอนันต์,35110,,
พานันเทพ,รชกานต์พงศ์,35110,,
ทามินภา,นภเดชพงศ์,35110,,
สาธีสิทธิ์,กฤวัฒน์มงคล,35110,,
มิรัตพร,ศรเรือนอรุณ,35110,,
ศิลินกุล,กฤวัฒน์พงศ์,35110,,
วีธีกุล,ภรเมธาธีรา,35110,,
วีลินชัย,วรสิทธิ์ภาณุ,35110,,
ศิธินรักษ์,วรกานต์กิจ,35110,,
วีธีนันท์,กฤเมธาอรุณ,35110,,
กิธินนันท์,นภสิทธิ์ศิริ,35110,,
รารัตดา,ภรเดชศิริ,35110,,
กิมินทร์,ศรกานต์มงคล,35110,,
นารินดา,นภไกรภาณุ,35110,,
พาสินกุล,นภภัทรมงคล,35110,,
วีลินดา,สิรเดชกิตติ,35110,,
กิมินรักษ์,วรเมธามงคล,35110,,
สาลินกุล,กฤเรือนวิชัย,35110,,
ลารินดา,วรเรือนภาณุ,35110,,
กินันกุล,ภรวัฒน์กิตติ,35110,,
มิธินรักษ์,ภรวัฒน์อรุณ,36000,,
กิสินทร์,ศรเมธาพงศ์,36000,,
ลาสินกุล,พลไกรธีรา,36000,,
พาสินเทพ,นภโชติอรุณ,36000,,
ทานันนันท์,วรภัทรธีรา,36000,,
วีภัคนันท์,สิรสิทธิ์ศิริ,36000,,